,sentence,label,data,regex
0,Journal Pre-proof,0.0,,False
1,Real-World Evidence of Neutralizing Monoclonal Antibodies for Preventing Hospitalization and Mortality in COVID-19 Outpatients,1.0,COVID-19,True
2,"Matthew K. Wynia, MD, MPH, Laurel E. Beaty, MS, Tellen D. Bennett, MD, MS, Nichole E. Carlson, PhD, MS, Christopher B. Davis, MD, Bethany M. Kwan, PhD, MSPH, David A. Mayer, BS, Toan C. Ong, PhD, Seth Russell, MS, Jeffrey D. Steele, RN, Heather R. Stocker, MA, Adane F. Wogu, PhD, Richard D. Zane, MD, Ronald J. Sokol, MD, Adit A. Ginde, MD, MPH",0.0,,False
3,PII: DOI: Reference:,0.0,,False
4,S0012-3692(22)04033-8 https://doi.org/10.1016/j.chest.2022.10.020 CHEST 5338,0.0,,False
5,To appear in: CHEST,0.0,,False
6,Received Date: 20 October 2022 Accepted Date: 22 October 2022,0.0,,False
7,"Please cite this article as: Wynia MK, Beaty LE, Bennett TD, Carlson NE, Davis CB, Kwan BM, Mayer DA, Ong TC, Russell S, Steele JD, Stocker HR, Wogu AF, Zane RD, Sokol RJ, Ginde AA, RealWorld Evidence of Neutralizing Monoclonal Antibodies for Preventing Hospitalization and Mortality in COVID-19 Outpatients, CHEST (2022), doi: https://doi.org/10.1016/j.chest.2022.10.020.",1.0,COVID-19,True
8,"This is a PDF file of an article that has undergone enhancements after acceptance, such as the addition of a cover page and metadata, and formatting for readability, but it is not yet the definitive version of record. This version will undergo additional copyediting, typesetting and review before it is published in its final form, but we are providing this version to give early visibility of the article. Please note that, during the production process, errors may be discovered which could affect the content, and all legal disclaimers that apply to the journal pertain.",0.0,,False
9,Copyright © 2022 Published by Elsevier Inc under license from the American College of Chest Physicians.,0.0,,False
10,Real-World Evidence of Neutralizing Monoclonal Antibodies for Preventing Hospitalization and Mortality in COVID-19 Outpatients,1.0,COVID-19,True
11,"Matthew K. Wynia, MD, MPHa,i,j; Laurel E. Beaty, MSb; Tellen D. Bennett, MD, MS c,f; Nichole E. Carlson, PhD, MSb,f; Christopher B. Davis, MDd; Bethany M. Kwan, PhD, MSPHd,e,f; David A. Mayer, BSb; Toan C. Ong, PhDc; Seth Russell, MSc; Jeffrey D. Steele, RNg; Heather R. Stocker, MAe; Adane F. Wogu, PhDb; Richard D. Zane, MDd; Ronald J. Sokol, MDf,h; Adit A. Ginde, MD, MPHd,f",0.0,,False
12,"Journal Pre-proof a Center for Bioethics and Humanities, University of Colorado, Anschutz Medical Campus,",0.0,,False
13,"Aurora, CO b Department of Biostatistics and Informatics, Colorado School of Public Health, Aurora, CO c Section of Informatics and Data Science, Department of Pediatrics, University of Colorado School of Medicine, Aurora, CO d Department of Emergency Medicine, University of Colorado School of Medicine, Aurora, CO e Department of Family Medicine, University of Colorado School of Medicine, Aurora, CO f Colorado Clinical and Translational Sciences Institute, University of Colorado Anschutz Medical Campus, Aurora, CO g Research Informatics, Children's Hospital Colorado, Aurora, CO h Section of Pediatric Gastroenterology, Hepatology and Nutrition, Department of Pediatrics, University of Colorado School of Medicine, Aurora, CO i Department of Medicine, University of Colorado School of Medicine, Aurora, CO j Department of Health Systems Management and Policy, Colorado School of Public Health, Aurora, CO",1.0,Clinical,True
14,See Supplement for a full list of Contributors.,0.0,,False
15,"Corresponding author Adit A. Ginde, MD, MPH Department of Emergency Medicine University of Colorado School of Medicine 12401 E. 17th Ave, Mail Stop B-215 Aurora, CO 80045, USA Email: adit.ginde@cuanschutz.edu",0.0,,False
16,Short title/running head: mAbs for COVID-19 Outpatients,1.0,COVID-19,True
17,"Financial/non-financial disclosures: This study was funded by National Institutes of Health / National Center for Advancing Translational Sciences grants UL1TR002525, UL1TR00253503S3 and UL1TR002535-04S2. Dr. Wynia received research funding from Patient-Centered",0.0,,False
18,1,0.0,,False
19,"Outcomes Research Institute and Office of the Assistant Secretary for Preparedness and Response and is an unpaid advisor to National Academies of Sciences, Engineering, and Medicine, including on crisis standards of care during the COVID-19 pandemic, and to Defense Advanced Research Projects Agency, the Hastings Center, and the Lancet on projects unrelated to monoclonal antibody (mAb) treatment. Dr. Bennett received research grants from the NIH outside the current work. Dr. Carlson received research grants from the NIH outside the current work. Dr. Ginde received other COVID-19 research grants from NIH, Department of Defense (DoD), Centers for Disease Control, AbbVie and Faron Pharmaceuticals, outside the current work. Other authors have no disclosures to report.",1.0,COVID-19,True
20,Journal Pre-proof Summary Conflict of Interest Statement: The authors have no conflicts of interest to report.,0.0,,False
21,"These study results are posted as a preprint on medRxiv DOI: https://doi.org/10.1101/2022.01.09.22268963) they are not currently under review at any other journal nor presented publicly. KEYWORDS: COVID-19, monoclonal antibody, outpatient, delta variant, hospitalization, mechanical ventilation",1.0,COVID-19,True
22,"ABBREVIATION LIST: CI, confidence interval; COVID-19, Coronavirus disease 2019; EHR, electronic health record; ED, emergency department; EUA, emergency use authorization; ICU, intensive care unit; LOS, length of stay; mAb, monoclonal antibody; OR, odds ratio; NNT, number-needed-to-treat; SARS-CoV-2, severe acute respiratory syndrome coronavirus-2; SD, standard deviation",1.0,COVID-19,True
23,2,0.0,,False
24,Word count text: 2788 Word count abstract: 300,0.0,,False
25,Real-World Evidence of Neutralizing Monoclonal Antibodies for Preventing Hospitalization and Mortality in COVID-19 Outpatients,1.0,COVID-19,True
26,Journal Pre-proof Short title/running head: mAbs for COVID-19 Outpatients,1.0,COVID-19,True
27,"KEYWORDS: COVID-19, monoclonal antibody, outpatient, delta variant, hospitalization, mechanical ventilation ABBREVIATION LIST: CI, confidence interval; COVID-19, Coronavirus disease 2019; EHR, electronic health record; ED, emergency department; EUA, emergency use authorization; ICU, intensive care unit; LOS, length of stay; mAb, monoclonal antibody; OR, odds ratio; NNT, number-needed-to-treat; SARS-CoV-2, severe acute respiratory syndrome coronavirus-2; SD, standard deviation",1.0,COVID-19,True
28,1,0.0,,False
29,"ABSTRACT Background: Neutralizing monoclonal antibodies (mAbs) were authorized for treatment of COVID-19 outpatients based on clinical trials completed early in the pandemic, which were underpowered for mortality and subgroup analyses. Real-world data (RWD) studies are promising for further assessing rapidly-deployed therapeutics.",1.0,COVID-19,True
30,Journal Pre-proof Research Question: Did mAb treatment prevent progression to severe disease and death across,1.0,disease,True
31,"pandemic phases and based on risk factors including prior vaccination status? Study Design and Methods: This observational cohort study included non-hospitalized adult patients with SARS-CoV-2 infection from November 2020-October 2021, using electronic health records from a statewide health system plus state-level vaccine and mortality data. Using propensity matching, we selected approximately 2.5 patients not receiving mAbs for each patient who received mAb treatment under emergency use authorization. The primary outcome was 28day hospitalization; secondary outcomes included mortality and hospitalization severity. Results: Of 36,077 patients with SARS-CoV-2 infection, 2,675 receiving mAbs were matched to 6,677 not receiving mAbs. Compared to mAb-untreated patients, mAb-treated patients had lower all-cause hospitalization (4.0% vs 7.7%; adjusted OR 0.48, 95%CI 0.38-0.60) and all-cause mortality (0.1% vs. 0.9%; adjusted OR 0.11, 95%CI 0.03-0.29) to day 28; differences persisted to day 90. Among hospitalized patients, mAb-treated patients had shorter hospital length of stay (5.8 vs. 8.5 days) and lower risk of mechanical ventilation (4.6% vs. 16.6%). Results were similar for preventing hospitalizations during the Delta variant phase (adjusted OR 0.35, 95%CI 0.25-0.50) and across subgroups. Number-needed-to-treat (NNT) to prevent hospitalization was lower for subgroups with higher baseline risk of hospitalization--e.g., multiple comorbidities (NNT,17) and not fully vaccinated (NNT,24) vs. no comorbidities (NNT,88) and fully vaccinated (NNT,81).",1.0,pandemic,True
32,2,0.0,,False
33,"Interpretation: Real-world data revealed a strong association between receipt of mAbs and reduced hospitalization and deaths among COVID-19 outpatients across pandemic phases. RWD studies should be used to guide practice and policy decisions, including allocation of scarce resources.",1.0,COVID-19,True
34,roof l Pre-p Journa,0.0,,False
35,3,0.0,,False
36,"High rates of coronavirus disease 2019 (COVID-19) transmission and illness persist, especially among unvaccinated individuals, as well as those with waning vaccine or infection-related immunity, such as older adults or those with certain chronic medical conditions.1,2 Neutralizing monoclonal antibody (mAb) treatment provides immediate passive immunity against severe acute respiratory syndrome coronavirus-2 (SARS-CoV-2), the virus that causes COVID-19.",1.0,coronavirus,True
37,Journal Pre-proof Several mAb products have received emergency use authorization (EUA) from the US Food and,0.0,,False
38,"Drug Administration.3 These authorizations were based on early Phase II/III randomized controlled trials that demonstrated reduction in a combined endpoint of hospitalization or death among high-risk outpatients with early symptomatic infection, though these trials were small in size with few deaths and conducted before the emergence of the Delta variant or widespread availability of vaccines against SARS-CoV-2.4-6",1.0,trial,True
39,"Once a promising therapeutic agent has been authorized for emergency use, it becomes more challenging to recruit patients into randomized controlled trials, as patients may seek active therapy and clinicians may view randomization to placebo as unethical.7 Consequently, studies of mAbs following EUA have primarily been small observational trials, confirming reduced hospitalization rates but not large enough to detect a mortality benefit nor to assess any potential heterogeneity of mAb treatment effects by comorbid conditions or vaccination status.8-10 The latter information could be especially useful in policymaking about how best to allocate limited access to mAb treatment during shortages.11,12 Furthermore, no published studies have yet directly evaluated the effectiveness of currently available mAbs against the Delta variant of SARS-CoV-2, which arose in summer 2021 in the US.",1.0,trial,True
40,"The rapidly-evolving nature of the COVID-19 pandemic, including both the emergence of new variants of the virus and use of EUAs allowing early access to novel therapeutics, makes it critical to build robust research platforms for real-world evidence generation.13,14 In early",1.0,COVID-19,True
41,4,0.0,,False
42,"2021, we created a real-world evidence platform to assess the ongoing clinical impacts of mAb therapy on high-risk outpatients with early symptomatic COVID-19.",1.0,clinical,True
43,"Our study objective was to evaluate the effectiveness of mAb treatment and progression to severe disease, including hospitalization, severity of hospitalization, and mortality. The goal of the overall platform was to include changes in the pandemic, including emergence of new",1.0,disease,True
44,"Journal Pre-proof variants, in near real-time with sufficient power to assess potential mortality benefits and",0.0,,False
45,"effectiveness among patients with various risk factors for progression to severe disease, including vaccination status.",1.0,disease,True
46,5,0.0,,False
47,"METHODS Study Oversight and Data Sources We conducted a propensity-matched observational cohort study, as part of a statewide implementation/effectiveness pragmatic trial, in a collaboration between University of Colorado researchers, University of Colorado Health leaders, and the Colorado Department of Public",1.0,trial,True
48,Journal Pre-proof Health and Environment. The study was approved by the Colorado Multiple Institutional Review,0.0,,False
49,"Board with a waiver of informed consent (#21-2935). We obtained data from the electronic health record (EHR; Epic, Verona, WI) of University of Colorado Health, the largest health system in Colorado with 13 hospitals around the state and 141,000 annual hospital admissions. EHR data were merged with statewide data on vaccination status from the Colorado Comprehensive Immunization Information System and mortality from Colorado Vital Records. Patient Population Studied We included patients diagnosed with SARS-CoV-2 infection between November 20, 2020 and October 7, 2021 allowing for at least 28 days of follow-up as of November 4, 2021 (n,""36,077), identified using EHR-based date of SARS-CoV-2 positive testing (by polymerase chain reaction or antigen tests) or date of administration of mAb treatment (if no SARS-CoV-2 test result date available). The decision to seek mAb treatment was made by patients and clinicians, and a statewide referral system was established by Colorado Department of Public Health and Environment to facilitate patient referrals to facilities for mAb infusion.15 We did not exclude patients solely for lack of EUA eligibility based on EHR data, because not all eligibility criteria were consistently available in the EHR (see additional Methods in the Supplement). We excluded patients who received mAb treatment on the same day of or during hospitalization, as these patients already had the primary outcome. Logistic regression was used for propensity score estimation16 with nearest neighbor matching17 applied to select an approximate 2.5:1 mAb-""",1.0,SARS-CoV-2,True
50,6,0.0,,False
51,"untreated to mAb-treated matched cohort. Matching factors included baseline demographics, clinical variables, and time (see additional Methods in the Supplement). The primary analysis cohort included patients with a documented mAb administration date (n,""2,675) and propensitymatched controls who did not receive mAb treatment (n"",""6,677). We assessed effectiveness of matching using standardized mean differences.18""",1.0,clinical,True
52,Journal Pre-proof Outcomes,0.0,,False
53,"The primary outcome was all-cause hospitalization within 28 days of a positive SARS-CoV-2 test, obtained from EHR data. Secondary outcomes included all-cause hospitalization to day 90, all-cause mortality to days 28 and 90, and emergency department (ED) visits to day 28. Among those hospitalized, outcomes included disease severity based on maximum level of respiratory support, hospital and intensive care unit (ICU) length of stay (LOS), and rates of ICU admission, mechanical ventilation, and in-hospital mortality. Subgroups examined for the primary outcome included age, sex, combined race/ethnicity, insurance status, immunocompromised status, total number of other comorbidities, specific comorbidities, vaccination status, pandemic phase, and type of mAb treatment. Variable Definitions The treatment variable was mAb administration and the primary starting point (time zero) was the date of any SARS-CoV-2 positive test. We imputed missing test dates based on the distribution of observed mAb administration dates (see additional Methods in the Supplement). Hospitalization was defined as any inpatient or observation encounter documented in the EHR. ED visits were defined as any visit to the ED, with or without an associated inpatient or observation encounter. Presence of comorbid conditions were determined using a 90-day look back period in the EHR using established algorithms and immunosuppressed status was further validated by manual chart reviews (see additional Methods in the Supplement). COVID-19",1.0,positive,True
54,7,0.0,,False
55,"disease severity was estimated using ordinal categories of respiratory support requirements at an encounter level, based on the highest level of support received among the following types (in increasing order): no oxygen, standard (nasal cannula/face mask) oxygen, high-flow nasal cannula or non-invasive ventilation, and invasive mechanical ventilation.19 In-hospital mortality was the highest level of disease severity.",1.0,disease,True
56,Journal Pre-proof Pandemic phase was categorized by SARS-CoV-2 positive date based on the prevalent,1.0,Pandemic,True
57,"variant in Colorado as Pre-Alpha (November 2020 - February 2021), Alpha (March 2021 - June 2021), and Delta (July 2021 - December 2021). No virus sequencing results were available on an individual patient basis. Vaccination status at the time of SARS-CoV-2 positive date was categorized as fully vaccinated (at least 14 days after primary vaccine series) or not fully vaccinated, which included partially vaccinated (receipt of at least one vaccine dose but primary series either not completed or completed within 14 days of SARS-CoV-2 positive test date) or not known to be vaccinated. MAb treatments included bamlanivimab (Eli Lilly), casirivimab + imdevimab (Regeneron), bamlanivimab + etesevimab (Eli Lilly), and sotrovimab (GlaxoSmithKline) (see additional Methods in the Supplement for more details). Statistical analysis We present results descriptively and adjusted for potential confounders. All regression models for outcomes were adjusted for age, sex, race/ethnicity, insurance status, body mass index (BMI), immunocompromised status, number of comorbidities, pandemic phase, and vaccination status. For binary outcomes such as hospitalization, we used logistic regression to determine odds of the outcome. For count outcomes such as LOS, we used Poisson regression to estimate incidence rates. We analyzed disease severity using ordinal logistic regression to estimate the proportional odds. We constructed cumulative incidence curves using Kaplan-Meier estimates to visually assess temporal trends by treatment status.",1.0,SARS-CoV-2,True
58,8,0.0,,False
59,"We conducted subgroup analyses to estimate heterogeneity of treatment effect for the primary outcome of all-cause hospitalization to day 28. For each subgroup, we calculated unadjusted rates of hospitalization, number needed to treat (NNT) to prevent one hospitalization (based on absolute risk reduction in unadjusted hospitalization rates), and adjusted relative odds of hospitalization. Results are presented as effect sizes, with 95% confidence intervals, and were",1.0,,True
60,"Journal Pre-proof not adjusted for multiple comparisons. Three sensitivity analyses were performed (see additional Methods in the Supplement). Briefly, the first evaluated a full imputation approach for missingness in key variables including BMI, immunocompromised status, race/ethnicity, and number of comorbid conditions. The second included only EUA-eligible subjects as verified by available EHR data. The third used a more conservative imputation method for missing SARS-CoV-2 positive test dates by assuming all missing positive test dates were ten days prior to the mAb administration date (the maximum time difference allowed by the EUA). All outcome models were repeated for these two cohorts and results compared with primary analyses. All statistical analyses were performed using R Statistical Software (version 3.6.0; R Foundation for Statistical Computing, Vienna, Austria).20",1.0,SARS-CoV-2,True
61,9,0.0,,False
62,"RESULTS Characteristics of mAb-Treated and mAb-Untreated Cohorts Of 36,077 patients with SARS-CoV-2 infection, 2,675 receiving mAbs were matched to 6,677 patients not receiving mAbs (Appendix Figure 1 in the Supplement). The characteristics of mAb-treated and mAb-untreated patients in the primary cohort are presented in Table 1. The",1.0,SARS-CoV-2,True
63,"Journal Pre-proof mAb-treated cohort generally reflects EUA criteria for use of mAbs, with many being older",0.0,,False
64,"(40.7% were age 65 years), having higher BMI (50.1% with BMI over 25 kg/m2) and/or having one or more comorbidities (73.6%). While there were clinically important differences between mAb-treated and mAb-untreated patents in the full cohort (Appendix Table 1 in the Supplement), propensity matching eliminated clinically meaningful differences between groups on matching variables (Table 1, Appendix Table 2 in the Supplement). The mean time from positive SARS-CoV-2 test to receipt of mAb treatment was 3.7 days (SD 2.5). Hospitalization and Mortality The rate of 28-day all-cause hospitalization was lower among mAb-treated compared to matched mAb-untreated controls (4.0% v 7.7%; adjusted OR 0.48, 95%CI: 0.38-0.60) (Table 2; full model results Appendix Table 3 in the Supplement). All-cause 28-day mortality in the mAbtreated group was 0.1% compared to 0.9% among the mAb-untreated group (adjusted OR 0.11, 95%CI: 0.03-0.29). These differences persisted to day 90 (adjusted OR 0.53; 95%CI: 0.44-0.65 for 90-day hospitalization and 0.17; 95%CI: 0.06-0.35 for 90-day mortality). Overall ED visit rates were higher for mAb-treated compared to mAb-untreated patients (18.7% vs. 16.9%; adjusted OR 1.24; 95%CI: 1.09-1.40); however, mAb-treated patients had fewer ED visits resulting in hospitalization (16.0% vs. 37.6%; adjusted OR 0.29, 95%CI: 0.21-0.38).",1.0,clinical,True
65,"Based on a time-to-event analysis, the benefits associated with reduced hospitalization are largely accrued within 10 days of the positive test date, while the mortality benefit of mAb",1.0,positive,True
66,10,0.0,,False
67,"treatment continues to accrue over 28 days (Figure 1). Treatment benefits persisted to day 90 for both hospitalization and death (Appendix Figure 2 in the Supplement). Severity of Hospitalization For patients requiring hospitalization, prior receipt of mAbs was associated with lower hospital LOS among survivors (5.8 vs. 8.5 days, adjusted incidence rate ratio 0.64, 95%CI: 0.51-0.82)",0.0,,False
68,"Journal Pre-proof and a lower rate of ICU admission (12.0% vs. 19.6%; adjusted OR 0.52, 95%CI 0.26-0.97), and",0.0,,False
69,"mechanical ventilation or death (4.6% vs. 16.6%; adjusted OR 0.22, 95%CI: 0.07-0.52) (Table 2). For those requiring ICU care, prior receipt of mAbs was associated with shorter ICU LOS (3.5 vs. 8.6 days; adjusted incidence rate ratio 0.22; 95%CI: 0.10-0.48). Overall, severity of hospitalization was lower across the illness continuum for mAb-treated patients (Figure 2). Subgroup Analyses The relative benefit of mAb therapy on reducing 28-day hospital admissions among key demographic and clinical subgroups was broadly similar across all subgroups (Figure 3). Of note, the association between mAb treatment and prevention of hospitalizations was at least as high during the Delta phase (OR 0.35; 95%CI: 0.25-0.50), compared to the Alpha phase (OR 0.67; 95%CI: 0.46-0.98). In addition, there was similar relative effectiveness for fully vaccinated (OR 0.44; 95%CI: 0.25-0.77) and not fully vaccinated (OR 0.49; 95%CI: 0.39-0.62) patients. However, the absolute treatment effect was higher for subgroups with higher baseline risk of hospitalization. For example, the number needed to treat (NNT) to prevent one hospitalization was 15 for patients age 65 years or older, 17 for those with at least 2 comorbid conditions, and 24 for those not fully vaccinated against SARS-CoV-2, compared to NNT of 45 for age 18-45 years, 88 for those without comorbidities, and 81 for fully vaccinated patients. Notably, only a small proportion of patients who were fully vaccinated against SARS-CoV-2 were hospitalized",1.0,clinical,True
70,11,0.0,,False
71,"(1.8% of mAb-treated and 3.0% of mAb-untreated; Figure 3), and no patients died who were fully vaccinated and received mAb treatment. Sensitivity Analyses Three sensitivity analyses were performed, the first evaluating a full multiple imputation approach to key missing variables, the second restricting the cohort to only patients meeting",0.0,,False
72,"Journal Pre-proof EUA eligibility criteria based on available EHR data, and the third using a more conservative",0.0,,False
73,imputation method when the date of positive SARS-CoV-2 test was missing. None of these analyses materially changed the main results (Appendix Tables 4-8 in the Supplement).,1.0,positive,True
74,12,0.0,,False
75,"DISCUSSION We report real-world evidence that demonstrates novel results on both high effectiveness of mAb treatment in reducing hospitalization during the Delta variant phase and a remarkable overall mortality benefit with an 89% lower mortality at 28 days. Neutralizing mAbs are widely seen as important tools for managing surging cases of COVID-19, yet prior studies could not evaluate",1.0,case,True
76,Journal Pre-proof effectiveness of mAbs against Delta variant infections and have been underpowered to evaluate,0.0,,False
77,impact of mAbs on the most clinically important outcome: patient mortality. The present study fills these key knowledge gaps.,1.0,clinical,True
