,sentence,label,data,regex295,"collection day and in 44% (8/18) of the collections when saliva was culture negative. In surface collections, the same numbers were 60% (3/5) and 65% (11/17).",1.0,negative,True
296,3.6 | SARS-­CoV-­2 antibodies in serum samples,0.0,,False
297,"Serum samples were obtained from 21 hospital-­treated patients (13 index patients and six other patients on the ward) and four home-­ treated patients (two index patients and two other patients). In total, 10 serum samples were positive for IgG or Nabs. Antibodies were detected at the earliest on symptom Day 3 (P13, positive with two IgG tests, Nab titer 80). Of the antibody-­positive patients, 9/10 were qRT-­PCR positive from saliva and one (P16, symptom Day 11, Nab titer 80) was also positive in viral culture. The index patients had Nabs against SARS-­CoV-­2 in five of the collections, and in four of these, PCR-­positive environmental samples were detected (active air samples in one (P49, Nab titer >640), deposition air samples in two (P41 and P43, Nab titers 40 and 10), and surface samples in two (P13 and P43, Nab titers 80 and 10)).",1.0,positive,True
298,OKSANEN et al.,0.0,,False
299,3.7 | Transmission of COVID-­19 to family members,1.0,Transmission,True
300,"The spread of COVID-­19 within the family was examined by collecting saliva samples from family members of the five home-­treated patients and analyzing qRT-­PCR results and SARS-­CoV-­2 antibody levels. In two families that used protective measures, including respiratory protection (surgical mask or respirator) and intensified cleaning, no further infections were detected. One of these families used masks in common areas, but not in their own rooms behind closed doors. In another family, the bedroom was shared, and masks were used all the time. However, in three families that did not apply any protective measures or used only intensified cleaning, secondary infections were observed. In two families, all other family members were infected, and in one family, one out of three other family members was infected. (See Supplementary Material for details regarding measures used to prevent further infections).",1.0,spread,True
301,4 | DISCUSSION,0.0,,False
302,"This study detected considerable SARS-­CoV-­2 RNA contamination from both home and hospital environments. The virus was found in the air in particle size ranges of 0.65-­4.7 m, 7.0-­12.0 m, >10 m, and<100m in diameter (Table 2), supporting existing literature.17,19,20,22 Our findings also support discoveries that normal respiratory activities generate infective particles even in the absence of AGPs,2,6,64,65 and respiratory symptoms. Additionally, low oxygen saturation showed a connection with a higher possibility of SARS-­CoV-­2 surface findings and a potential connection with air findings, which could follow from increased particle generation due to respiratory stress. Most (83%, 15/18) of our positive air samples with known particle size were in particles smaller than 4.7 m, which supports the findings that at least 85% of the viral load is emitted in aerosols smaller than 5 m.6,20,66 This is in line with the fact that particle generation produces a distribution which form depends on the activity that is causing the particles. In human respiratory activities, generated particles are mainly small, under 5 m in dry size distribution.67,68",1.0,respiratory,True
303,"A previous study showed that a high sampling flow rate increases the success rate in detecting SARS-­CoV-­2 from air samples.21 When 50L/min air samplers were used, no positive samples were detected, but when sampling flowrate was raised to 150L/min 72% of samples were positive.21 In our study, SARS-­CoV-­2 was detected from the air with a minimum collection period of 10 min (Andersen's impactor) and a minimum air volume of 72L (Button sampler). With an average respiratory rate of 14/min and volume of 0.5 L/breath, this would mean exposure times of 40min (Andersen) and 10 min (Button) for the examined virus variants (alpha and undetermined VoC (Andersen), as well as non-­VoC (Button)). Current safety guidelines use 15min exposure time regarding contact tracing.69 Our results, although limited due to the low number of collections and only qRT-­PCR findings, support concerns that a shorter exposure time should be considered, at least for close contacts.70 Overall,",1.0,positive,True
304, | 11 of 17,0.0,,False
305,"the exposure risk is cumulating with time and no limit to zero risk can be determined. The risk for infection depends on the concentration exposed to (depending on ventilation and produced quanta) as well as persons immunity.27,71-­73 Virus variants such as the delta and omicron variants seem to lower the exposure time needed for infection, following estimated higher viral load in the presence of the delta variant74 and increased transmissibility of omicron variants possibly due immune evasion.75,76 Also, already low infectious doses have been shown to cause infection in an animal model.38,77 A previous study did not observe significant differences in environmental contamination prevalence or Ct values between alpha and omicron B.1.1.529, which could further point toward a higher receptor binding affinity and immune escape properties of omicron variant78 and enable the use of studies carried out with previous variants also when evaluating the environmental burden of newer variants.",1.0,infectious,True
306,"Our results from respiratory activities demonstrated that 0.5-­2 min of activity did not produce enough virus to be detected with qRT-­PCR with this methodology, even from a close distance of 10 cm. However, it should be noted that the open deposition collection method for both respiratory activities and passive air (deposition) samples is highly dependent on the success of the impactation and the flow field near the collection surface,79 being susceptible for example to head movements and indoor air flows. Still, a quite high proportion (11.5%) of passive air samples was positive for SARS-­ CoV-­2 RNA. This supports the role of aerosol particle deposition as a source to surface contamination as previous studies have suggested.17,80 The deposition offers more gentle collection method and possibility to collect directly to the cells or cell media possibly allowing more viral preservation compared to active sampling. This could at least partly explain why viral findings were seen in our work and in previous work17 when active aerosol samples remained negative.",1.0,respiratory,True
307,"Multiple positive air samples were collected from a large (655.25m3) mechanically ventilated hospital hall (Figure 1), even when there were only two patients. Overall, larger spaces are considered safer than small ones due to the larger air volume per person.81 However, it seems that also larger indoor spaces may form a risk environment if occupied by an infected person for a prolonged time period.82-­84 In our study, all patients in the ward were COVID patients. However, in many countries, COVID-­positive patients have been separated from COVID-­negative ones with just curtains and distance. As hospital-­acquired infections have been a significant part of overall infections and deaths,85-8­ 7 it is important to reduce the risk of infections in hospital wards. It should be noted that the infective aerosol particles may still generate an infection risk even when larger space allows more dilution with increasing distance, as shown by Karan et al.88 Our findings were mainly from a close distance similar to a previous study that saw higher probability to environmental findings inside 2-­meter range,24 even though the risk for infection especially in prolonged exposure remains also further away.27,28",1.0,positive,True
308,It is interesting that the proportion of the positive samples was similar in hospital and home even when the ventilation was more efficient in the hospital and patients have later symptom day. This may be due to more patients in the same room or higher overall viral load,1.0,positive,True
309,"16000668, 2022, 10, Downloaded from https://onlinelibrary.wiley.com/doi/10.1111/ina.13118 by MORGAN STATE UNIVERSITY, Wiley Online Library on [17/11/2022]. See the Terms and Conditions (https://onlinelibrary.wiley.com/terms-and-conditions) on Wiley Online Library for rules of use; OA articles are governed by the applicable Creative Commons License",0.0,,False
310,"16000668, 2022, 10, Downloaded from https://onlinelibrary.wiley.com/doi/10.1111/ina.13118 by MORGAN STATE UNIVERSITY, Wiley Online Library on [17/11/2022]. See the Terms and Conditions (https://onlinelibrary.wiley.com/terms-and-conditions) on Wiley Online Library for rules of use; OA articles are governed by the applicable Creative Commons License",0.0,,False
311,12 of 17 |,0.0,,False
312,OKSANEN et al.,0.0,,False
313,"which has been associated with more severe disease and higher age in previous studies.89,90 We observed a trend for an older age being associated with a higher viral load (Figure S5a) and a larger number of positive surface samples but confirming this would require further studies with a larger sample sizes. In earlier studies, higher viral loads have been associated with an increased probability of viral transmission.91,92 Possible reasons for the relationship between age and infectivity include reduced saliva production, differences in mucus viscosity and salivary immunoglobulins,93 increased expression of the ACE2 receptors needed for cell entry of SARS-­CoV-­2,94 thinning of the epithelium,95 and impairment of the immune response with age.96",1.0,disease,True
314,"Toilet surface samples were positive only when the index patient-­reported GI symptoms. Infectious SARS-­CoV-­2 has been recovered from urine and stool samples,97 and flushing of the toilet and vomiting can generate aerosols, which will later deposit on the surfaces.98,99 This risk should be noted in both environments and toilets should not be shared with non-­COVID patients, if possible. Other more frequently qRT-­PCR-­positive surfaces included highly touched personal items, hospital equipment, and the floor, which is in line with the previous findings.18,19,34 Even though RNA may persist on surfaces for some time, RNA findings most likely result from contamination on the same day due to daily cleaning.",1.0,positive,True
315,"The building body of evidence supports airborne route predominance for SARS-­CoV-­2 transmission,1-­4,14 and an animal study indicates that aerosol inoculation is a more efficient route and causes more severe pathology and higher viral loads.100 Fomites have not been proven to serve as the sole or primary vehicle of transmission.101 The probability for surface transmission is estimated to be likely rare, generally less than 1 in 10 000, and the disease manifestation milder.102 The environmental samples that commonly presented infectious virus in previous studies were mainly in direct contact with infected patients' mucus membranes, or saliva or sputum secretions (e.g., nasal prongs, nasal canula, used tissue, patients mask, and endotracheal tube).25,38 In this study, families that took protective measures (including isolation of the infected family member) and respiratory protection (surgical masks or FFP2 respirators) were able to prevent further infections even when qRT-­PCR-­positive samples were collected from both surfaces and air. However, in a household where all surfaces were cleaned many times a day but no respiratory protection was used, all family members became infected. This supports the importance of air hygiene, including also portable air cleaners as a supportive method as shown in previous studies,15,28 and also encourages control of infection spread in homes. Similar findings supporting the use of masks, isolation with closed door, and opening windows in home environment were found to lower the risk of contamination in the work of Picard et al.103 Overall our results indicate that transmission may happen through several transmission routes as supported also in previous systematic review.20 Infection control is even more important with VoC strains that feature a higher rate of household transmission.104",1.0,transmission,True
316,"To better understand the infectivity and state of the infection compared to the environmental findings, we collected saliva and",0.0,,False
317,"serum samples. SARS-­CoV-­2 was cultured from saliva during symptom Days 2-­11.42 SARS-­CoV-­2 RNA was detected in the saliva of patients who had already formed IgG and NAbs, which align with previous findings of prolonged RT-­PCR-­positivity.105-­107 In addition, the saliva of P16 on symptom Day 11 was still positive in virus culture, even though the patient had NAbs. Moreover, we obtained positive air and surface samples when the index patient had a positive IgG result and NAbs, which agrees with the findings of Lei et al.108 This contradicts the suggestion that NAbs solely could be a reliable marker for non-­infectivity78. In the view of infection control, we agree with Lei et al.,108 Tan et al.109 and Wölfel et al.110 that the risk for exposure can remain after the patient starts to seroconvert and possibly improve clinically. As seroconversion seems an unreliable marker for viral clearance, other means, such as an antigen test, should be used to assess the infection risk before ending precaution protocols.111,112",1.0,positive,True
318,"Showing viable virus from environmental is highly demanding. Previous studies have presented a few possibly positive findings.10-­13,36-­38,66 However, the findings of those studies have been under criticism as none of them has been able to show clear CPE with significant decrease in Ct values leaving questions if the CPE was truly induced by SARS-­CoV-­2. Despite the culturing attempts of all 258 air samples and 212 surface samples, we were unable to detect viable virus from the environment. Also, only 20% of qRT-­PCR-­positive saliva samples of symptomatic patients were positive in cell culture. We did several attempts to optimize the culture protocol (Supplementary Methods) and performed qRT-­PCR on culture media whenever the slightest sign of CPE was detected. Explanations for our negative results are that there was no infectious virus in the environment at the time of the samplings or that current methods were not sensitive enough to detect it. As SARS-­CoV-­2 is efficiently transmitted in hospital wards and between family members,113,114 even from quarantine room to another via corridor and similarly timed door opening,115 we conclude that the methodology is likely too unsensitive.116 A significant loss of infective viruses in air sampling has also been demonstrated,117-­123 and current impaction and impingement sampling methods have low collection efficiency for small, nanometer-­sized particles.121,122 Sousa et al. managed to show SARS-­CoV-­2 related PFU findings with electrostatic air sampler, which may provide a more gentle collection method, however, even they observed rapid and significant inactivation of the virus during collection.12 The absolute collection efficiencies of the samplers are unknown and should be addressed in future research.123 Even though detection of viral RNA in the air and on the surface does not necessarily mean an infectious virus, negative culturing results do not rule out the infection risk either. Due to these difficulties and the high transmission rates, we consider already RNA findings to be interpreted as a possible infection risk. In the future, sampling methods and devices should be developed to better preserve the viability and infectivity, for example mimicking the humidity and airflow of the airways to avoid mechanical stress and utilizing direct collection onto the cells or culture medium to avoid losses during transport. In an ideal situation, the future sampling methods would",1.0,positive,True
319,"16000668, 2022, 10, Downloaded from https://onlinelibrary.wiley.com/doi/10.1111/ina.13118 by MORGAN STATE UNIVERSITY, Wiley Online Library on [17/11/2022]. See the Terms and Conditions (https://onlinelibrary.wiley.com/terms-and-conditions) on Wiley Online Library for rules of use; OA articles are governed by the applicable Creative Commons License",0.0,,False
320,OKSANEN et al.,0.0,,False
321, | 13 of 17,0.0,,False
322,"also allow on-­site recognition of the viruses from air as well as from surfaces.124 Also, additional methods (e.g., virus sequencing) that can be applied to a large number of samples should be utilized and further developed in future studies on environmental transmission.",1.0,transmission,True
323,"Overall, this study combined a large number of environmental samples and detailed patient data to more comprehensively understand environmental contamination and the effect of patient-­ dependent factors. The patient material was representative regarding symptoms and laboratory results for COVID-­19.125 In addition to the hospital environment, we collected samples from homes where symptoms are generally less severe, the time from the onset of symptoms is shorter, and air conditioning is different from that of a hospital. Recent findings suggest that the environmental contamination is rather similar between the first variants and omicron,78 suggesting that the results from the earlier variants can still be considered to provide valid information for the current situation.",1.0,,True
324,"Our study also has some limitations. Even though the overall number of our samples is quite high compared to previous studies, it is still limited in the statistical aspect and only able to detect major differences and associations. As environmental sampling is time consuming and resource intensive, making it challenging to achieve a statistically large enough sample size, it is important to combine findings from several different studies for more detailed analysis. We only conducted environmental sampling at a single time point. In the future, a longitudinal examination could enable a more accurate examination of the effects of the course of disease for environmental contamination. The mean time from the onset of symptoms until sampling varied between homes and hospital and may affect the results. However, as the infection requiring hospital treatment is more severe, the viral loads may stay high longer,112,126 and accordingly, no major differences were detected in viral load in saliva in our study between homes and hospital patients. This would provide rather similar expectation for environmental contamination as Buonanno et al examined.14 Also, patients generally arrive to the hospital at the later stage of the disease (excluding hospital-­acquired infections that were not detected in this dataset) which makes our dataset suitable to represent the real situation between homes and hospitals. In addition, we only measured the IgG and NAb response, but viral secretion from mucus membranes can continue if the IgA response is weak.127 The IgA immune response should thus be examined further in upcoming studies. The qRT-­PCR results might include some uncertainty due to the differences in the texture and fluidity of saliva and should be considered as estimates. As many samples were collected from a large patient hall, it is possible that some observed viruses might have originated from other than the index patient. However, most of the surface samples were from patient-­specific surfaces, and aerosols are known to concentrate near the source,71 indicating that most of the positive samples are expected to be produced by the index patient. Particle size cutoffs in Andersen samplers might be slightly higher than estimated, as the amount of liquid used in the sampling was slightly smaller than recommended due to practical reasons. Finally, we strongly suggest developing a new,",1.0,disease,True
325,more sensitive methodology for assessing the virus viability to better assess transmission mechanisms.,1.0,transmission,True
326,5 | CONCLUSIONS,0.0,,False
327,"This study found SARS-­CoV-­2 RNA from air samples in wide range of different-­sized particles during normal respiratory activity from both home and hospital environment. We observed positive air samples from a large ventilated patient hall in collections corresponding to 10 min of normal respiration, although current restricted air sampling techniques may have caused some virus loss. We also detected SARS-­CoV-­2 RNA-­positive air and surface samples after patients had developed antibodies. These results highlight the need for appropriate infection control against airborne and surface transmission routes in both environments, even after antibody production has begun.",1.0,respiratory,True
328,"AUTHOR CONTRIBUTIONS Lotta-­Maria A. H. Oksanen, Jenni Virtanen, Antti-­Pekka Hyvärinen, Vinaya Venkat, Kirsi Aaltonen, Ilkka Kivistö, Lev Levanov, T.S., S.S., L.M, N.S.A., N.R., E.S, and S.L., designed the study and developed the methodology. Lotta-­Maria A. H. Oksanen, Jenni Virtanen, Vinaya Venkat, Kirsi Aaltonen, Svetlana Sofieva, Nina S. Atanasova, Aurora Díaz Pérez, Noora Rantanen, Joel Kuula, and Julija Svirskaite collected the samples. Jenni Virtanen, Vinaya Venkat, Kirsi Aaltonen, Ilkka Kivistö, Aurora Díaz Pérez, Leena Maunula, and Joel Kuula, analyzed the samples. Lotta-­Maria A. H. Oksanen and Jenni Virtanen analyzed and visualized the data. Lotta-­Maria A. H. Oksanen and Jenni Virtanen wrote the original draft. All authors revised and edited the manuscript. Tarja Sironen, Nina S. Atanasova, Leena Maunula, and A.G. supervised the study. Lotta-­Maria A. H. Oksanen, Antti-­ Pekka Hyvärinen, Tarja Sironen, Nina S. Atanasova, Enni Sanmark, Veli-­Jukka Anttila, Lasse Lehtonen, Maija Lappalainen, and Ahmed Geneid were responsible for project administration, funding, and recourses.",0.0,,False
329,"ACKNOWLEDGMENTS We thank Esa Pohjalainen for assistance in the laboratory, Emma Klemetti for the illustrations of Figure 2, Sampo Oksanen for the help with the data tables and Dekati Ltd for lending measurement equipment. This study was financially supported by Business Finland Corona Co-­Creation funding 40988/31/2020, the Scientific Advisory Board for Defense (MATINE) grant number VN/627/2020-­ PLM-­9 (materials and equipments), Academy of Finland funding number 309570 and Academy of Finland COVID-­19 special funding number 335681, as well as Helsinki University Hospital research grant M7100COVID, Jalmari ja Rauha Ahokkaan Säätiö--­grant and Jane and Aatos Erkko foundation.",1.0,equipment,True
330,CONFLICT OF INTEREST The authors declare no competing interests.,0.0,,False
331,14 of 17 |,0.0,,False
332,DATA AVAIL ABILIT Y STATEMENT All data are included in the article or its online Supplementary Material and are available from the corresponding author upon request.,0.0,,False
333,ORCID Lotta-­Maria A. H. Oksanen https://orcid. org/0000-0002-0344-5078 Jenni Virtanen https://orcid.org/0000-0001-6518-3088 Svetlana Sofieva https://orcid.org/0000-0001-5343-0870 Kirsi Aaltonen https://orcid.org/0000-0001-8901-6866 Ilkka Kivistö https://orcid.org/0000-0002-9657-0555 Julija Svirskaite https://orcid.org/0000-0002-2448-0841 Joel Kuula https://orcid.org/0000-0003-3270-5972 Antti-­Pekka Hyvärinen https://orcid.org/0000-0001-7938-071X Leena Maunula https://orcid.org/0000-0002-0841-5353 Nina S. Atanasova https://orcid.org/0000-0003-1120-7405 Veli-­Jukka Anttila https://orcid.org/0000-0001-7734-9241 Lasse Lehtonen https://orcid.org/0000-0002-3443-3838 Maija Lappalainen https://orcid.org/0000-0001-5400-1250 Ahmed Geneid https://orcid.org/0000-0003-1617-1181 Tarja Sironen https://orcid.org/0000-0002-2344-2755,0.0,,False
334,"REFERENCES 1. MacIntyre CR, Ananda-­Rajah MR. Scientific evidence supports aerosol transmission of SARS-­COV-­2. Antimicrob Resist Infect Control. 2020;9:202. 2. Greenhalgh T, Jimenez JL, Prather KA, Tufekci Z, Fisman D, Schooley R. Ten scientific reasons in support of airborne transmission of SARS-­CoV-­2. Lancet. 2021;397(10285):1603-­1605. 3. Tang JW, Marr LC, Li Y, Dancer SJ. Covid-­19 has redefined airborne transmission. BMJ. 2021;373:n913. 4. Wang CC, Prather KA, Sznitman J, et al. Airborne transmission of respiratory viruses. Science. 2021;373(6558):eabd9149. 5. Lewis D. COVID-­19 rarely spreads through surfaces. So why are we still deep cleaning? Nature. 2021;590:26-­28. 6. Coleman KK, Tay DJW, Tan KS, et al. Viral load of severe acute respiratory syndrome coronavirus 2 (SARS-­CoV-­2) in respiratory aerosols emitted by patients with coronavirus disease 2019 (COVID-­19) while breathing, talking, and singing. Clin Infect Dis. 2021;74:1722-­1728. doi:10.1093/CID/CIAB691 7. Bulfone TC, Malekinejad M, Rutherford GW, Razani N. Outdoor transmission of SARS-­CoV-­2 and other respiratory viruses: a systematic review. J Infect Dis. 2021;223:550-­561. 8. Fears AC, Klimstra WB, Duprex P, et al. Persistence of severe acute respiratory syndrome coronavirus 2 in aerosol suspensions. Emerg Infect Dis. 2020;26:2168-­2171. 9. van Doremalen N, Bushmaker T, Morris DH, et al. Aerosol and surface stability of SARS-­CoV-­2 as compared with SARS-­CoV-­1. N Engl J Med. 2020;382:1564-­1567. doi:10.1056/nejmc2004973",1.0,transmission,True
335,"10. Lednicky JA, Lauzardo M, Fan ZH, et al. Viable SARS-­CoV-­2 in the air of a hospital room with COVID-­19 patients. Int J Infect Dis. 2020;100:476-­482.",0.0,,False
336,"11. Lednicky JA, Lauzardo M, Alam MM, et al. Isolation of SARS-­CoV-­2 from the air in a car driven by a COVID patient with mild illness. Int J Infect Dis. 2021;108:212-­216.",1.0,Isolation,True
