,sentence,label,data,regex
0,"16000668, 2022, 10, Downloaded from https://onlinelibrary.wiley.com/doi/10.1111/ina.13118 by MORGAN STATE UNIVERSITY, Wiley Online Library on [17/11/2022]. See the Terms and Conditions (https://onlinelibrary.wiley.com/terms-and-conditions) on Wiley Online Library for rules of use; OA articles are governed by the applicable Creative Commons License",0.0,,False
1,Received: 14 May 2022 | Revised: 25 August 2022 | Accepted: 6 September 2022,0.0,,False
2,DOI: 10.1111/ina.13118,0.0,,False
3,ORIGINAL ARTICLE,0.0,,False
4,SARS-­CoV-­2 indoor environment contamination with epidemiological and experimental investigations,0.0,,False
5,"Lotta-­Maria A. H. Oksanen1,2 | Jenni Virtanen1,3 | Enni Sanmark1,2| Noora Rantanen1,2| Vinaya Venkat1,3| Svetlana Sofieva4,5 | Kirsi Aaltonen1,3 | Ilkka Kivistö1,3 | Julija Svirskaite4 | Aurora Díaz Pérez3| Joel Kuula5 | Lev Levanov1| Antti-­Pekka Hyvärinen5 | Leena Maunula3 | Nina S. Atanasova4,5 | Sirpa Laitinen6| Veli-­Jukka Anttila1,7 | Lasse Lehtonen1,8 | Maija Lappalainen1,8 | Ahmed Geneid1,2 | Tarja Sironen1,3",0.0,,False
6,"1Faculty of Medicine, University of Helsinki, Helsinki, Finland 2Department of Otorhinolaryngology and Phoniatrics -­ Head and Neck Surgery, Helsinki University Hospital, Helsinki, Finland 3Faculty of Veterinary Medicine, University of Helsinki, Helsinki, Finland 4Faculty of Biological and Environmental Sciences, University of Helsinki, Helsinki, Finland 5Finnish Meteorological Institute, Helsinki, Finland 6Finnish Institute of Occupational Health, Kuopio, Finland 7HUS Inflammation Center, Helsinki University Hospital, Helsinki, Finland 8HUS Diagnostic Center, HUSLAB, Helsinki University Hospital, Helsinki, Finland",0.0,,False
7,"Correspondence Lotta-­Maria A. H. Oksanen, Department of Otorhinolaryngology and Phoniatrics -­ Head and Neck Surgery, Helsinki University Hospital, Maistraatinportti 2, PO Box 250, 00029 Helsinki, Finland. Email: lotta.oksanen@hus.fi",0.0,,False
8,Funding information Academy of Finland; Business Finland; Helsingin ja Uudenmaan Sairaanhoitopiiri; Jalmari ja Rauha Ahokkaan Säätiö; Jane ja Aatos Erkon Säätiö; Scientific Advisory Board for Defense,0.0,,False
9,"Abstract SARS-­CoV-­2 has been detected both in air and on surfaces, but questions remain about the patient-­specific and environmental factors affecting virus transmission. Additionally, more detailed information on viral sampling of the air is needed. This prospective cohort study (N ,""56) presents results from 258 air and 252 surface samples from the surroundings of 23 hospitalized and eight home-­treated COVID-­19 index patients between July 2020 and March 2021 and compares the results between the measured environments and patient factors. Additionally, epidemiological and experimental investigations were performed. The proportions of qRT-­PCR-­positive air (10.7% hospital/17.6% homes) and surface samples (8.8%/12.9%) showed statistical similarity in hospital and homes. Significant SARS-­CoV-­2 air contamination was observed in a large (655.25m3) mechanically ventilated (1.67 air changes per hour, 32.4-­421L/s/patient) patient hall even with only two patients present. All positive air samples were obtained in the absence of aerosol-g­ enerating procedures. In four cases, positive environmental samples were detected after the patients had developed a neutralizing IgG response. SARS-­CoV-­2 RNA was detected in the following particle sizes: 0.65-­4.7 m, 7.0-­12.0 m, >10 m, and <100m. Appropriate infection control against airborne and surface transmission routes is needed in both environments, even after antibody production has begun.""",1.0,transmission,True
10,"KEYWORDS air sample, infection control, neutralizing antibody response, SARS-­CoV-­2, surface sample",0.0,,False
11,Lotta-­Maria A. H. Oksanen and Jenni Virtanen contributed equally to this work as first authors.,0.0,,False
12,"This is an open access article under the terms of the Creative Commons Attribution License, which permits use, distribution and reproduction in any medium, provided the original work is properly cited. © 2022 The Authors. Indoor Air published by John Wiley & Sons Ltd.",0.0,,False
13,Indoor Air. 2022;32:e13118. https://doi.org/10.1111/ina.13118,0.0,,False
14,wileyonlinelibrary.com/journal/ina | 1 of 17,0.0,,False
15,"16000668, 2022, 10, Downloaded from https://onlinelibrary.wiley.com/doi/10.1111/ina.13118 by MORGAN STATE UNIVERSITY, Wiley Online Library on [17/11/2022]. See the Terms and Conditions (https://onlinelibrary.wiley.com/terms-and-conditions) on Wiley Online Library for rules of use; OA articles are governed by the applicable Creative Commons License",0.0,,False
16,2 of 17 |,0.0,,False
17,1 | INTRODUCTION,0.0,,False
18,"Increasing scientific evidence indicates the dominance of short-­and long-­range airborne transmission of SARS-­CoV-­2.1-­6 The observed transmission risks have been higher indoors than outdoors,7 and discussion on precautions for hospital and home environments has been intense. In a study that aerosolized SARS-­CoV-­2 under laboratory conditions, aerosols' infectivity was retained for up to 16h,8 while another study estimated the half-­life in aerosols to be approximately 1.1-1­ .2 h (95% CI 0.64-­2.64).9 Outside of the laboratory, signs of viable SARS-­CoV-­2 in the air have been detected,10-­12 and the virus has also been cultured from exhaled air.13 A direct link between SARS-­CoV-­2 viral load, emission, and airborne concentration was recently demonstrated by Buonanno et al.14 A few studies have detected SARS-­CoV-­2 RNA in the air at home-­environment.15,16 In hospitals, PCR-­based studies have found SARS-­CoV-­2 RNA in room air,17-­25 as well as from air conditioning filters located over 50m from the patient room.26 Even though previous studies have mainly used long collection times or high flow rates, challenge is that only a proportion of the air present in a room can be analyzed. Additionally, indoor turbulence highly affects local concentrations.27,28 Thus, questions remain about the risk of infection during shorter meetings or in rooms with a larger air space, and whether the findings would be similar in the home environment. As environmental sampling is highly demanding and sample sizes rather small, more patient data are also needed to draw further conclusions in future systematic reviews.",1.0,transmission,True
19,"According to laboratory studies, the stability of SARS-­CoV-­2 on surfaces varies depending on the surface type and environmental conditions.9,29-­32 However, its ability to sustain infectivity on surfaces outside laboratory conditions is largely unknown.33 SARS-­CoV-­2 RNA has been found, for example, on high-­touch surfaces, floors, and toilets,18,19,34,35 and there are a few possibly positive culture findings of SARS-­CoV-­2 from the surfaces.36-­38 The effect of age and neutralizing antibodies (NAbs) on the spread of SARS-­CoV-­2 has been speculated,39-4­ 1 but there is a lack of clear evidence for the role of patient-­related factors.",1.0,positive,True
20,"This study sought to increase knowledge of SARS-­CoV-­2 transmission in different environments by analyzing air, surface, and patient samples from a COVID-­19 cohort ward in Helsinki University Hospital (HUS), Finland, and from patients' homes. The aims were to determine whether SARS-­CoV-­2 RNA or viable virus could be found in the home and hospital environments, and which patient-­and environment-­related factors affect the risk of environmental contamination. A team consisting of researchers from HUS, the University of Helsinki, the Finnish Meteorological Institute, and the Finnish Institute of Occupational Health was established to enable a multidisciplinary approach to the above research questions.",1.0,transmission,True
21,OKSANEN et al.,0.0,,False
22,Practical implications · The finding of SARS-­CoV-­2 RNA from the air in the ab-,0.0,,False
23,sence of aerosol generating procedures (AGP) and in the absence of respiratory symptoms emphasizes the use of respiratory protection and airborne precautions also in situations where AGPs are not performed and regardless of the patients' symptoms. · Families that used respiratory protection were able to prevent further infections. · Air and surface contamination was detected in both homes and hospital even though the day from the start of the symptoms was later in hospital measurements. This may follow from more severe disease and increased viral loads which were associated with older age. Infection control measures should be used in both environments to prevent further infections.,1.0,respiratory,True
24,"been observed to be highest in early disease, the patient with the most recent onset of symptoms was selected as the index patient,42 except for collection 13, where all the patients in the room had been symptomatic for over 10days and the patient with the freshest positive PCR result (P26) was selected (Table S1). Environmental measurements were performed in the vicinity of the index patients. Saliva samples were also collected from other patients who were in the ward at the same time and who agreed to the study in 4 collections (named as ""other""). Family members of the home patients were examined for infection and seroconversion. Environmental sampling was performed twice with patients P2 and P3, and P2 was considered as an index due to the more recent start of the symptoms; however, some personal items from both were sampled. The sampling process is presented in a flow chart in Figure 1.",1.0,disease,True
25,"All research personnel conducting the sampling followed aerosol safety protocols and precautions and no infections were detected. All procedures that involved human participants, including environmental sampling, were conducted in accordance with the ethical standards of the institutional or national research committee and the 1964 Declaration of Helsinki and its later amendments or comparable ethical standards. The Ethics Committee of Helsinki University Hospital approved the study protocol (HUS/1701/2020). All respondents provided written informed consent prior to their participation.",0.0,,False
26,2 | METHODS,0.0,,False
27,2.1 | Index patients and safety measures,0.0,,False
28,Patients were voluntary participants with a qRT-­PCR-­confirmed symptomatic COVID-­19 infection between 1.7.2020 and 16.3.2021. None of the participants had been vaccinated. As infectivity has,1.0,symptomatic,True
29,2.2 | Infection prevention protocols in the hospital,0.0,,False
30,"The infection prevention and control protocols on the COVID ward included hand hygiene, universal masking for staff (FFP2/3 for ICU and surgical masks for the COVID ward), guidance on social distancing (2 m), and personal protecting equipment (PPE) following droplet precautions. The patients did not use face masks. The ward and",1.0,mask,True
31,"16000668, 2022, 10, Downloaded from https://onlinelibrary.wiley.com/doi/10.1111/ina.13118 by MORGAN STATE UNIVERSITY, Wiley Online Library on [17/11/2022]. See the Terms and Conditions (https://onlinelibrary.wiley.com/terms-and-conditions) on Wiley Online Library for rules of use; OA articles are governed by the applicable Creative Commons License",0.0,,False
32,OKSANEN et al.,0.0,,False
33, | 3 of 17,0.0,,False
34,F I G U R E 1 Patient inclusion and sampling process and additional analysis performed in the study,0.0,,False
35,ICU were cleaned twice a day between 9 to 10 am and 4 to 5 pm. The sample collections were done between cleaning around 11am to 9 pm and thus reflect quite reliably patients' infection status of the collection day. The specific cleaning protocol is presented in the supplement.,0.0,,False
36,2.3 | Cell lines,0.0,,False
37,"Vero E6 cells (VE6) and their TMPRSS2-­expressing clone VE6-­ TMPRSS2-­10 (VE6T)43 were grown as previously described.44 To inhibit fungal growth, 0.205g/ml of amphotericin B (Fungizone, Thermo Scientific) was added to the medium of the cells that were taken to the hospital for aerosol collections. The used VE6 cell line is originally from ATCC (American type Culture Collection45), and the VE6T cell line has been modified from the original line according to the previous study.43",0.0,,False
38,2.4 | Sampling protocols for air sampling,0.0,,False
39,"Seven different air collection methods were used. Details of the collections and samples are presented in Table S3. Sampling times and air volumes varied between different sampling methods depending on the expected optimal collection time for each device according to the manufacturer and previous studies, and",0.0,,False
40,"the knowledge gathered during the study. A Dekati PM10 cascade impactor (20L/min air flow, model PMS-­420) with three stages (>10.0 m, 2.5-­10 m, and 1.0-­2.5 m), including a backup filter for particles <1 m, was used in 11 collections. The three impaction stages were fitted with 25-­mm-­diameter cellulose acetate membrane filters (CA filter, GE Healthcare Life Sciences) and the backup plate with a 40-­mm CA filter. Analyzing the three stages and backup filter, particle distribution according to aerodynamic size (PM10, PM2.5, and PM1) can be ascertained. The collector was placed within 1-­2 m from the patient, and particles were collected for 2-­4 h. After sampling, filters were immediately placed in 2 ml (25-­mm filter) or 3 ml (40-­mm filter) of minimal essential Eagle's medium (MEM, Sigma-­Aldrich).",0.0,,False
41,"The BioSpot 300p bioaerosol sampler prototype (Aerosol Devices Inc.) has a flow rate of 8 L/min and a mechanism that allows water to condense on aerosol particles from as small as 5-­10 nm to 20m in diameter and minimize the stress when the sample is impacted onto the surface with the collection medium. To increase the sample collection rate, the biosampler is equipped with eight wicking tubes fitted with three nozzle jets to secure gentle transfer of the sample. This sampler was used in 8 collections for 1.5-­4 h within a distance of 1-­2.5 m from the patient, and the sample was collected in 1-­2 ml of MEM.",0.0,,False
42,"As a more portable solution for personal area air sampling, a standard 25-­mm gelatin (Sartorius Stedim Biotech) or mixed cellulose ester (MCE) filter equipped in the Button sampler with a Gilian",1.0,personal,True
43,"16000668, 2022, 10, Downloaded from https://onlinelibrary.wiley.com/doi/10.1111/ina.13118 by MORGAN STATE UNIVERSITY, Wiley Online Library on [17/11/2022]. See the Terms and Conditions (https://onlinelibrary.wiley.com/terms-and-conditions) on Wiley Online Library for rules of use; OA articles are governed by the applicable Creative Commons License",0.0,,False
44,4 of 17 |,0.0,,False
45,OKSANEN et al.,0.0,,False
46,"5000 air sampling pump, 4 L/min air flow, and a porous curved surface inlet was used in 9 collections. The Button sampler collects particles smaller than 100m.46 The stability of SARS-­COV-­2 on two filter materials was compared under laboratory conditions to select the more optimal filter type and to optimize the collection time (details in Supplementary Material). Samples were collected for 10-­30min from patients' breathing area. Depending on the health status, a conversation was prompted to increase the output of aerosols. The collection filter was removed into 3 ml of MEM immediately after collection ended.",1.0,curve,True
47,"Three Andersen cascade impactors (400W pump and 28.3 L/min flow rate) were used simultaneously in six collections. The impactors consist of six stages with size cut points of (1) >7 m, (2) 4.7-­7.0 m, (3) 3.3-­4.7 m, (4) 2.1-­3.3 m, (5) 1.1-­2.1 m, and (6) 0.65-­1.1 m. An additional inlet was used during measurements limiting the upper limit of the particle size to 12m. To ensure the correct volume flow rate, each Andersen impactor was fitted with a TSI flow meter. Samples were collected using Petri dishes (94/16MM) with 15ml of cell medium for 10, 20, and 30min. The medium was transferred onto VE6T cells grown on 100/20MM cell culture dishes either immediately after collection in the hospital (collections 24, 25, 27, and 29) or later in the laboratory (collection 31).",0.0,,False
48,"To evaluate the real-­time particle number concentration during the hospital collections and to gather additional air samples, a Dekati eFilter was used in two collections. The eFilter monitors changes in real-­time particle concentration by utilizing a small diffusion charger powered by an inner chargeable battery. The charge changes were automatically translated into a signal, which was recorded on a data card. When postprocessing the data, the raw charge signal was further converted to represent particle number concentrations using a conversion factor (411cm-3 fA-1) provided by the manufacturer. A count median diameter (CMD) of 60nm and a geometric standard deviation (GSD) of 1.5 were assumed.47,48 In addition, the eFilter simultaneously collected samples on a 47-­mm gelatin filter using an external pump. After sample collection, the gelatin filter was transferred into 6 ml of MEM. The eFilter was fitted with the same EPA-­designed inlets as the Andersen cascade impactors. The particle size cut point of the inlets was approximately 12m, with an air volume flow rate of 28.3 L/min. The duration of sample collection was 30min at a similar distance from the patient as with Andersen's cascade impactors.",1.0,,True
49,"Passive air samples were collected either directly on VE6 cells (2 collections) or VE6T cells (9 collections) grown on 100/20MM (collection 22) or 35/10MM (other collections) cell culture dishes or on empty 35/10MM Petri dishes containing 1 ml of growth medium (10 collections). Open dishes were positioned at different proximities from the patient for 30-­60min, and the patient was encouraged to perform an aerosol-­producing activity such as talking. The ability of SARS-­CoV-­2 to infect cells at room temperature was confirmed, and major differences in the culture sensitivity of these two collection methods were excluded under laboratory conditions (see Supplementary Methods for details).",0.0,,False
50,Living cells were transported to the laboratory in a warm environment with heat accumulators warmed to 37°C. One plate was used as a negative control to ensure that the cells survived the transport. Other samples were transported with cold accumulators and handled during the same or next day.,1.0,negative,True
51,2.5 | Sampling protocols for surface sampling,0.0,,False
52,"Altogether, 252 surface samples in 26 collections for qRT-­PCR testing were taken from surfaces in possible direct or indirect contact with the patient (Table S3) with pre-­wetted Dacron swabs (Copan, 25 collections), a nitrile glove (1 collection), gauze (1 collection), or by pipetting the sampling liquid up and down on the surface a few times and transferring it into a sampling tube (3 collections). Swabs were placed into 1 ml of PBS. In 22 collections (212 samples), an additional sample was taken for virus culture, which was placed in 250l or 1 ml of MEM. Samples for qRT-­PCR and culturing were taken immediately next to each other. Surfaces were divided into four surface groups (high-­touch surfaces, low-­touch surfaces, toilet surfaces, and other surfaces) for statistical analyses.",1.0,contact,True
53,2.6 | Other sampling protocols,0.0,,False
54,"Saliva samples were taken from 26 index patients either with a Dacron swab (collections 5-­9) or by spitting into a Falcon tube (from collection 10 onwards). Ten additional saliva samples were collected from other patients from the ward in four collections and from seven healthy family members of home-­treated patients. If possible, patients were asked to rinse their mouth before sampling. In collection 23, the index patient and a healthy family member also took follow­up saliva samples until 12days from the start of the patient's symptoms. In collection 26, follow-­up saliva samples were taken from patients until Days 14-­17 from the start of symptoms.",0.0,,False
55,"Nasopharyngeal samples from consenting patients were taken and sent to HUSLAB for a fresh diagnostic PCR.49,50 Serum samples from consenting patients were taken within a day from sampling and tested for SARS-­CoV-­2 IgG antibodies with two different tests.51 Serum samples (dilutions 1:10 to 1:640) were studied with the microneutralization assay.52 Blood lymphocyte and eosinophil counts, and plasma CRP from consenting patients were measured within a day of sampling, and plasma ferritin, ALP, ALT, D-­dimer, and fibrinogen levels within 3days. The respiration rate and SpO2 levels were measured during the same day (Table S1).",0.0,,False
56,"Since the first cases caused by variants of concern (VoC) were detected in Finland at the end of December 2020, they were determined from all patients as a part of routine diagnostics. This information was used to compare the results between VoC strains (mainly alpha in Finland) and non-­VoC strains. Virus strains of collections 1-­22 (P1-­P45) were considered as non-­VoC, as they were collected before the first cases were reported in Finland.",1.0,case,True
57,"16000668, 2022, 10, Downloaded from https://onlinelibrary.wiley.com/doi/10.1111/ina.13118 by MORGAN STATE UNIVERSITY, Wiley Online Library on [17/11/2022]. See the Terms and Conditions (https://onlinelibrary.wiley.com/terms-and-conditions) on Wiley Online Library for rules of use; OA articles are governed by the applicable Creative Commons License",0.0,,False
58,OKSANEN et al.,0.0,,False
59, | 5 of 17,0.0,,False
60,"2.7 | RNA extraction and PCR protocols for air, saliva, and culture medium samples",0.0,,False
61,2.8 | RNA extraction and PCR protocols for surface samples,0.0,,False
62,"Trizol (Invitrogen) was used to extract RNA from all saliva samples and from air and culture medium samples of collections 1-­23 according to the manufacturers' instructions. A 200-­l sample was added to 800l of Trizol reagent, and a resuspension volume of 50l was used. RNA was extracted from air and culture medium samples of collections 24 onwards with a QIAcube HT system and QIAamp 96 Virus QIAcube HT kit (QIAgen) using off-­ board lysis.",0.0,,False
63,"All samples were tested with two different qRT-­PCRs, N Charité,53 and N1 US CDC,54 using TaqMan Fast Virus 1-­Step Master Mix (ThermoFisher), a 20-­l reaction volume, 45cycles/ run, and fast cycling mode (annealing temperatures 55°C (N1 US CDC) and 58°C (N Charité)). The primer and probe concentrations of N Charité were according to the original publication,53 and those of N1 US CDC were 500nM of both primers and 125nM of probe (Table S7). qRT-­PCRs were performed using a Stratagene Mx3005P instrument (Agilent Technologies) with a Ct cutoff value of 0.04. The results were considered positive if both qRT-­PCRs were positive with a Ct value under 40 or if one qRT-­PCR was positive with a Ct value under 38. Comparable cutoff limits have been used in previous studies.18,55,56 Samples with Ct values over 38 in one qRT-­ PCR and no Ct with the other one were treated as negative, even though the possibility of them being very weak positives could not be excluded. RNA extracted from the Fin/20 strain52 culture was used as a positive control and nuclease-­free water as a negative control. Limit of detection in different laboratories has been around 5 copies/reaction for N1 US CDC and up to 50 copies/reaction for N Charité.57",1.0,positive,True
64,"The N gene transcript for qRT-­PCR was prepared as follows: The target region (352-­712, 360bp) was amplified from SARS-­ CoV-­2 RNA, Wuhan strain, and cloned into pGEM-­T cloning vector (Promega) under control of the SP6 promoter. The presence of the insert was verified by sequencing and restriction enzyme analysis. After linearization of the plasmid by digestion with AscI (Thermo Fisher Scientific), RNA was generated using the RiboMAXTM Large Scale RNA production system with SP6 polymerase (Promega) according to the manufacturer's instructions. The transcribed RNA was then treated with DNAse I and purified with the RNeasy Mini Kit (QIAGEN). Finally, RNA was quantified by spectrophotometry, and the RNA copy number was calculated based on its concentration, length, and molecular weight. qRT-­PCR was performed with N Charité PCR by including a transcript dilution series from 10 to 109 copies/reaction in triplicate and samples in duplicate. Copy numbers as copies/ml of saliva were calculated by tracing back from copies/ reaction reported by MxPro software (standard curve equation: Y ,"" -3.570×LOG[X]+43.98, RSq "", 0.984). Quantitating air samples in a similar way was unsuccessful due to weak positive samples and repeated freeze-­and-­thaw cycles and copy numbers for those were estimated based on the Ct values from initial qRT-­PCR and above equation from a different run but the same protocol.",1.0,tracing,True
