,sentence,label,data,regex54,"Because anti-AngII antibodies developed in response to SARS-CoV-2 infection in hospitalized patients or vaccination with some adjuvants in mice, we hypothesized that anti-AngII antibodies may result from molecular structural mimicry between the AngII peptide and certain epitopes present in Spike or RBD. In that case, anti-AngII and antiRBD could potentially cross-bind to both antigens. To test this hypothesis, we assessed the binding of two murine IgG monoclonal anti-AngII antibodies (clone E7 and clone B938M) to recombinant SARS-CoV-2 Spike or RBD. We found that both monoclonal anti-AngII antibodies bound to Spike and RBD, although with a lower affinity to RBD than to Spike (Fig. 4A). We further demonstrated that the monoclonal anti-AngII antibodies may interfere with AngII binding to its cognate receptor AT1, suggesting that AngII-AT1 signaling could be modulated by the presence of anti-AngII (Fig. 4B).",1.0,SARS-CoV-2,True
55,"Conversely, we evaluated the ability of monoclonal anti-RBD antibodies, in a library of those isolated from SARS-CoV-2 infected patients, to bind to AngII. Among the 36 different monoclonal anti-RBD antibodies assessed, 9 showed some low to very-low binding to AngII, with one being superior to the others, namely clone S24-902 (Fig. 4C). We further confirmed the significant although low binding of 3 of these anti-RBD to AngII, respectively S24-902, S564-265 and S24-1002, by characterizing their affinity at various concentrations (Fig. 4D). In contrast, clone S564-14 did not show any specific binding to AngII and was used as a negative control. It is not surprising that the cross-reactivity of anti-RBD to AngII is low, considering that monoclonal anti-AngII also binds weakly to RBD (Fig. 4A) and that AngII is a short 8-amino acid peptide.",1.0,SARS-CoV-2,True
56,"We then sought to identify the epitopes of Spike or RBD that lead to crossreactivity to AngII. To do so, we tested the binding of the two monoclonal anti-AngII antibodies (clones E7 and B938M) to linear epitopes of Spike, using a peptide array that consists of a library of 15-mer peptides, shifted by 5 amino acids, covering the full-length of Spike. As a control for nonspecific binding, we used the secondary antibody only, in",0.0,,False
57,12,0.0,,False
58,"medRxiv preprint doi: https://doi.org/10.1101/2021.11.02.21265789; this version posted November 2, 2021. The copyright holder for this preprint (which was not certified by peer review) is the author/funder, who has granted medRxiv a license to display the preprint in perpetuity. It is made available under a CC-BY-NC-ND 4.0 International license .",0.0,,False
59,"the absence of anti-AngII antibody. Both anti-AngII E7 and B938M clones bound to several linear epitopes on Spike, with a main target at Spike residues aa1146-aa1160 located near the C-terminus, outside of RBD (Fig. 4E, Fig. S3A-C, spot J14 on the peptide array), and about 15 secondary targets of lower affinity. Five of the secondary peptides targeted by the clone E7 belong to the RBD of Spike, including 3 more particularly to the receptor-binding motif (RBM) of the RBD (Fig. 4E, Fig. S3A). In contrast, only 1 peptide targeted by the B938M clone belongs to the RBD region, in the RBM (Fig. 4E, Fig. S3B). Of note, although both Spike and AngII share the same receptor, ACE-2, their binding on ACE-2 occurs at 2 distinct locations (Fig. S4) (10, 11). Importantly, most regions targeted by clones E7 and/or B938M have been characterized as being the main B cells epitopes in COVID patients (colored regions in Fig. 4E, F, Fig. S3D) (12, 13). These regions, which are likely to contain the epitopes generating anti-AngII autoantibodies, are (1) aa21-aa40, (2) aa447-aa468, (3) aa551-aa585, (4) aa786-aa804, (5) aa1131-1160 of Spike.",0.0,,False
60,"We next compared the Spike epitopes targeted by polyclonal responses raised against RBD/Spike in vaccinated mice or in COVID patients to the ones targeted by the monoclonal anti-AngII. Thus, we repeated the peptide array assays using anti-AngII(+) or anti-AngII(-) pooled sera from 5 different mice vaccinated with Spike + MPLA/alum or RBD + MPLA/alum, or from 5 different COVID-19 patients.",1.0,COVID-19,True
61,13,0.0,,False
62,"medRxiv preprint doi: https://doi.org/10.1101/2021.11.02.21265789; this version posted November 2, 2021. The copyright holder for this preprint (which was not certified by peer review) is the author/funder, who has granted medRxiv a license to display the preprint in perpetuity. It is made available under a CC-BY-NC-ND 4.0 International license .",0.0,,False
63,"Figure 4. Cross-binding of anti-AngII antibodies to the SARS-CoV-2 Spike and RBD antigens. (A) Binding of two commercial monoclonal anti-AngII (clone E7 and clone B938M) to recombinant Spike and RBD at various concentrations by ELISA. (B) Inhibition of AngII binding to its cognate receptor AT1 in presence of the anti-AngII (clone E7 and B938M) on CHO-AT1 cells, measured by flow cytometry (ANOVA test with Tukey's post-test). (C) Binding of a library of monoclonal anti-RBD antibodies against AngII by ELISA (9 out of 36 tested showed signals of",1.0,SARS-CoV-2,True
64,14,0.0,,False
65,"medRxiv preprint doi: https://doi.org/10.1101/2021.11.02.21265789; this version posted November 2, 2021. The copyright holder for this preprint (which was not certified by peer review) is the author/funder, who has granted medRxiv a license to display the preprint in perpetuity. It is made available under a CC-BY-NC-ND 4.0 International license .",0.0,,False
66,"low binding). (D) Binding of 3 selected monoclonal anti-RBD (S24-902, S564-265 and S24-1002) to AngII at various concentrations as compared to a non-AngII-binding anti-RBD (S564-14). (E) Binding of monoclonal anti-AngII (clone E7 or B938M) to Spike linear epitopes using a peptide array. Highlighted colored regions represents the most immunogenic and recurrent B cell epitopes of Spike found in COVID patients (Shrock et al. (12), Li et al. (13)) and the associated numbers indicate the amino-acid positions that delineate these regions. The x-axis represents the fulllength of Spike (SP , signal peptide; NTD , N-terminal domain; RBD , receptor-binding domain; RBM , receptor-binding motif; CTD ,"" C-terminal domain; NTD, RBD and CTD together constitutes the S1 domain of Spike; T "", transmembrane domain; C , cytoplasmic tail). (F) Visualization of the main domains targeted by the monoclonal anti-AngII antibodies on the 3D structure of Spike (PDB,""6VXX, (14)). Domains are highlighted in colors on one monomer of the trimeric Spike structure (RBD is in black; aa# "", amino acid position of Spike).",0.0,,False
67,"We observed that mice raised anti-Spike/RBD antibodies in all regions previously targeted by the monoclonal anti-AngII upon vaccination with Spike+MPLA/alum (Fig. S5A), while mostly in the region aa447-aa468 upon vaccination by RBD+MPLA/alum (Fig. S5B). The profiles of anti-AngII(+) and anti-AngII(-) mice were very similar, except for a small increase in binding of anti-Spike to the region aa447aa468 and anti-RBD to aa551-585, in anti-AngII(+) mice. As to the COVID-19 patients, they raised anti-Spike antibodies against 3 out of the 5 anti-AngII-targeted regions, namely aa551-aa585, aa786-aa804 and aa1131-1160, with a slightly higher binding observed to aa786-aa804 in anti-AngII(+) plasma (Fig. S5C). Surprisingly, the region aa1131-1160 was better targeted in anti-AngII(-) plasma; this highlights that not every antibody that bind to anti-AngII-targeting regions would necessarily cross-react with AngII.",1.0,COVID-19,True
68,"Taken together, using monoclonal anti-AngII and anti-RBD antibodies, we demonstrate that antibody cross-binding between AngII and Spike/RBD can occur, even if weakly, which may suggest some structural homology between AngII and certain epitopes of Spike/RBD.",0.0,,False
69,15,0.0,,False
70,"medRxiv preprint doi: https://doi.org/10.1101/2021.11.02.21265789; this version posted November 2, 2021. The copyright holder for this preprint (which was not certified by peer review) is the author/funder, who has granted medRxiv a license to display the preprint in perpetuity. It is made available under a CC-BY-NC-ND 4.0 International license .",0.0,,False
71,"SARS-CoV-2 infection has been shown to induce broad immune dysregulation (15, 16), including generation of wide-ranging autoantibody responses (17). For example, generation of autoantibodies against phospholipids has been shown to contribute to coagulation disorders (18, 19), and against Type I interferons to reduced immune response to infection (20). Here, we show that autoantibodies can be generated against AngII, a key regulator of vascular tension. We further show that generation of anti-AngII autoantibodies correlated with disease severity as reflected in dysregulation of vascular tension and lower blood oxygenation. This, along with our in vitro signaling data, suggests that the anti-AngII autoantibodies, even if low affinity, may be able to interfere with signaling between AngII and its receptors AT1 and ACE-2. Interestingly, some COVID-19 patients had also been shown to develop autoantibodies against AT1 and ACE-2, which similarly correlated with enhanced pro-inflammatory responses and increased disease severity (21, 22). Such autoantibodies against AT1 and ACE-2 have been also observed in patients suffering from other vascular pathologies, particularly in malignant hypertension (8) or constrictive vasculopathy (9). Therefore, systematic quantification of autoantibodies against key molecules of the renin-angiotensin pathway (i.e. AngII, AT1, and ACE-2), in diseases characterized by vascular dysregulation, including COVID-19, might reveal a common underlying autoimmune etiology. Lastly, we highlighted the immune epitopes of Spike that could share structural homology with AngII, providing molecular insights in the immune mechanisms that could lead to the generation of anti-AngII autoantibodies upon infection by SARS-CoV-2.",1.0,SARS-CoV-2,True
72,16,0.0,,False
73,"medRxiv preprint doi: https://doi.org/10.1101/2021.11.02.21265789; this version posted November 2, 2021. The copyright holder for this preprint (which was not certified by peer review) is the author/funder, who has granted medRxiv a license to display the preprint in perpetuity. It is made available under a CC-BY-NC-ND 4.0 International license .",0.0,,False
74,References,0.0,,False
75,"1. K. Kuba, Y. Imai, T. Ohto-Nakanishi, J. M. Penninger, Trilogy of ACE2: a peptidase in the renin-angiotensin system, a SARS receptor, and a partner for amino acid transporters. Pharmacology and Therapeutics. 128, 119-128 (2010).",0.0,,False
76,"2. M. Bader, ACE2, angiotensin-(1-7), and Mas: the other side of the coin. Pflugers Arch. 465, 79-85 (2013).",1.0,flu,True
77,"3. F. Alhenc-Gelas, T. B. Drueke, Blockade of SARS-CoV-2 infection by recombinant soluble ACE2. Kidney Int. 97, 1091-1093 (2020).",1.0,SARS-CoV-2,True
78,"4. L. Samavati, B. D. Uhal, ACE2, Much More Than Just a Receptor for SARS-COV-2. Front Cell Infect Microbiol. 10, 317 (2020).",0.0,,False
79,"5. P. Verdecchia, C. Cavallini, A. Spanevello, F. Angeli, The pivotal link between ACE2 deficiency and SARS-CoV-2 infection. Eur J Intern Med. 76, 14-20 (2020).",1.0,SARS-CoV-2,True
80,"6. B. T. Rouse, S. Sehrawat, Immunity and immunopathology to viruses: what decides the outcome? Nat Rev Immunol. 10, 514-526 (2010).",0.0,,False
81,"7. J. Mercer, U. F. Greber, Virus interactions with endocytic pathways in macrophages and dendritic cells. Trends Microbiol. 21, 380-388 (2013).",0.0,,False
82,"8. M. L. X. Fu et al., Autoantibodies against the angiotensin receptor (AT1) in patients with hypertension. Journal of Hypertension. 18, 945 (2000).",0.0,,False
83,"9. Y. Takahashi, S. Haga, Y. Ishizaka, A. Mimori, Autoantibodies to angiotensin-converting enzyme 2 in patients with connective tissue diseases. Arthritis Research & Therapy. 12, R85-8 (2010).",1.0,disease,True
84,"10. R. Yan et al., Structural basis for the recognition of SARS-CoV-2 by full-length human ACE2. Science. 367, 1444-1448 (2020).",1.0,SARS-CoV-2,True
85,"11. J. L. Guy, R. M. Jackson, H. A. Jensen, N. M. Hooper, A. J. Turner, Identification of critical active-site residues in angiotensin-converting enzyme-2 (ACE2) by site-directed mutagenesis. FEBS J. 272, 3512-3520 (2005).",0.0,,False
86,"12. E. Shrock et al., Viral epitope profiling of COVID-19 patients reveals cross-reactivity and correlates of severity. Science. 370 (2020), doi:10.1126/science.abd4250.",1.0,COVID-19,True
87,"13. Y. Li et al., Linear epitope landscape of the SARS-CoV-2 Spike protein constructed from 1,051 COVID-19 patients. Cell Rep. 34, 108915 (2021).",1.0,SARS-CoV-2,True
88,"14. A. C. Walls et al., Structure, Function, and Antigenicity of the SARS- CoV-2 Spike Glycoprotein. Cell. 181, 281-292.e6 (2020).",0.0,,False
89,"15. E. J. Giamarellos-Bourboulis et al., Complex Immune Dysregulation in COVID-19 Patients with Severe Respiratory Failure. Cell Host Microbe. 27, 992-1000.e3 (2020).",1.0,COVID-19,True
90,"16. S. Bhattacharjee, M. Banerjee, Immune Thrombocytopenia Secondary to COVID-19: a Systematic Review. SN Compr Clin Med. 2, 1-11 (2020).",1.0,COVID-19,True
91,"17. M. Zuniga et al., Autoimmunity to Annexin A2 predicts mortality among hospitalised COVID-19 patients. Eur Respir J (2021), doi:10.1183/13993003.00918-2021.",1.0,COVID-19,True
92,"18. Y. Zuo et al., Prothrombotic autoantibodies in serum from patients hospitalized with",0.0,,False
93,17,0.0,,False
94,"medRxiv preprint doi: https://doi.org/10.1101/2021.11.02.21265789; this version posted November 2, 2021. The copyright holder for this preprint (which was not certified by peer review) is the author/funder, who has granted medRxiv a license to display the preprint in perpetuity. It is made available under a CC-BY-NC-ND 4.0 International license .",0.0,,False
95,"COVID-19. Sci Transl Med. 12 (2020), doi:10.1126/scitranslmed.abd3876. 19. J. M. Connors, J. H. Levy, COVID-19 and its implications for thrombosis and",1.0,COVID-19,True
96,"anticoagulation. Blood. 135, 2033-2040 (2020). 20. P. Bastard et al., Autoantibodies against type I IFNs in patients with life-threatening",0.0,,False
97,"COVID-19. Science. 370 (2020), doi:10.1126/science.abd4585. 21. A. I. Rodriguez-Perez et al., Autoantibodies against ACE2 and angiotensin type-1",1.0,COVID-19,True
98,"receptors increase severity of COVID-19. Journal of Autoimmunity. 122, 102683 (2021). 22. L. Casciola-Rosen et al., IgM autoantibodies recognizing ACE2 are associated with",1.0,COVID-19,True
99,"severe COVID-19. medRxiv, 2020.10.13.20211664 (2020).",1.0,COVID-19,True
100,"Acknowledgements: The authors would like to thank all members from the laboratories of Prof. Jeffrey A. Hubbell and Prof. Melody A. Swartz that participated on COVID research, Yuanyuan Zha, Hongyuan Jiao, Glee Guilan Li and Shuhan Yu for biobank COVID sample processing, Kelly M. Blaine for collecting samples from hypertensive and control donors and Prof. Prabha Siddarth (University of California Los Angeles, CA USA) for advice on data analysis. Funding: This study was funded by the University of Chicago, through the Chicago Immunoengineering Innovation Center, the Chicago Biomedical Consortium and the University of Chicago's ""Big Ideas Generator"" for COVID research. S.R.J. was supported by the T32 CA009566. Authors contributions: P.S.B, J.A.H., M.A.S designed the study, analyzed the data and wrote the manuscript. P.S.B. has performed the experiments. S.J.R., J.Y., A.R.P., J.T., T.F.G. and A.I.S collected patient samples and clinical data. S.J.R. processed and analyzed clinical data. H.L.D., C.T.S., S.C. and P.C.W. produced, purified, characterized and provided the monoclonal anti-RBD antibodies. All authors have reviewed the manuscript. Competing interests: P.S.B., J.A.H. and M.A.S. are named as inventors on US Provisional Patent 63/123,199, filed December 9, 2020, relating to measurement of anti-AngII in immune response. The University of Chicago has filed a patent application relating to anti-SARS-CoV-2 antibodies generated by P.C.W., H.L.D., and C.T.S. as co-inventors.",1.0,clinical,True
101,18,0.0,,False
102,"medRxiv preprint doi: https://doi.org/10.1101/2021.11.02.21265789; this version posted November 2, 2021. The copyright holder for this preprint (which was not certified by peer review) is the author/funder, who has granted medRxiv a license to display the preprint in perpetuity. It is made available under a CC-BY-NC-ND 4.0 International license .",0.0,,False
103,Supplementary Materials: Materials and Methods Fig. S1-S5,0.0,,False
104,19,0.0,,False
105,,0.0,,False
