,sentence,label,data,regex
0,"medRxiv preprint doi: https://doi.org/10.1101/2021.11.02.21265789; this version posted November 2, 2021. The copyright holder for this preprint (which was not certified by peer review) is the author/funder, who has granted medRxiv a license to display the preprint in perpetuity. It is made available under a CC-BY-NC-ND 4.0 International license .",0.0,,False
1,SARS-CoV-2 infection induces cross-reactive autoantibodies against angiotensin II,1.0,SARS-CoV-2,True
2,"Authors: Priscilla S. Briquez1, Sherin J. Rouhani2, Jovian Yu2, Athalia R. Pyzer2, Jonathan Trujillo2, Haley L. Dugan3,4, Christopher T. Stamper3,4, Siriruk Changrob3, Anne I. Sperling4,5, Patrick C. Wilson3,4, Thomas F. Gajewski2,4,6,7, Jeffrey A. Hubbell1,4,7, Melody A. Swartz1,4,6,7",0.0,,False
3,"Affiliations: 1 Pritzker School for Molecular Engineering, University of Chicago, Chicago, Illinois, USA 2 Department of Medicine, Section of Hematology/Oncology, University of Chicago, Chicago, Illinois, USA 3 Department of Medicine, Section of Rheumatology, University of Chicago, Chicago, Illinois, USA 4 Committee on Immunology, University of Chicago, Chicago, Illinois, USA 5 Department of Medicine, Section of Pulmonary and Critical Care Medicine, University of Chicago, Chicago, Illinois, USA 6 Ben May Department of Cancer Research, University of Chicago, Chicago, Illinois, USA 7 Committee on Cancer Biology, University of Chicago, Chicago, Illinois, USA",0.0,,False
4,ABSTRACT,0.0,,False
5,"Patients infected with the severe acute respiratory syndrome coronavirus-2 (SARS-CoV2) can experience life-threatening respiratory distress, blood pressure dysregulation and thrombosis. This is thought to be associated with an impaired activity of angiotensinconverting enzyme-2 (ACE-2), which is the main entry receptor of SARS-CoV-2 and which also tightly regulates blood pressure by converting the vasoconstrictive peptide angiotensin II (AngII) to a vasopressor peptide. Here, we show that a significant proportion of hospitalized COVID-19 patients developed autoantibodies against AngII, whose presence correlates with lower blood oxygenation, blood pressure dysregulation, and overall higher disease severity. Anti-AngII antibodies can develop upon specific immune reaction to the SARS-CoV-2 proteins Spike or RBD, to which they can crossbind, suggesting some epitope mimicry between AngII and Spike/RBD. These results provide important insights on how an immune reaction against SARS-CoV-2 can impair blood pressure regulation.",1.0,respiratory,True
6,"Keywords: COVID-19, angiotensin II, hypotension, blood pressure, autoimmunity",1.0,COVID-19,True
7,NOTE: This preprint reports new research that has not been certified by peer review and should not be used to guide clinical practice.,1.0,clinical,True
8,"medRxiv preprint doi: https://doi.org/10.1101/2021.11.02.21265789; this version posted November 2, 2021. The copyright holder for this preprint (which was not certified by peer review) is the author/funder, who has granted medRxiv a license to display the preprint in perpetuity. It is made available under a CC-BY-NC-ND 4.0 International license .",0.0,,False
9,"INTRODUCTION Severe acute respiratory syndrome coronavirus-2 (SARS-CoV-2), the causative",1.0,respiratory,True
10,"virus of coronavirus disease 2019 (COVID-19), infects cells by binding to angiotensinconverting enzyme-2 (ACE-2) via the receptor-binding domain (RBD) of its Spike protein. ACE-2 is an enzyme expressed on the surfaces of alveolar epithelial cells and vascular endothelial cells (1), among others, that plays an important role in regulating blood pressure by converting the vasoconstrictive peptide angiotensin II (AngII) to the vasopressor peptide angiotensin-(1-7) (2, 3). It is known that SARS-CoV-2 infection can lead to dysregulation of vascular tension, endothelial inflammation and enhanced thrombosis, presumably through enhancing endocytosis of ACE-2 and thereby lowering its cell-surface presence (4, 5).",1.0,coronavirus,True
11,"Here, we sought to explore whether SARS-CoV-2 infection might induce autoantibodies against the peptide AngII. We hypothesized that the simultaneous binding of SARS-CoV-2 and AngII to ACE-2 might lead to their co-phagocytosis by antigenpresenting cells, thus providing a strong immune adjuvant (the virus molecules) to the self-peptide AngII, leading to an anti-AngII autoimmune response (6, 7). Moreover, we asked whether some epitope mimicry might exist between a domain on the Spike protein and AngII, based on their shared binding to ACE-2. Importantly, the induction of antiAngII antibodies in COVID-19 patients, if it occurs, could interfere with AngII processing by ACE2 and signaling to its receptors, potentially contributing to the dysregulation of vascular tension and worsening acute respiratory distress syndrome(8, 9).",1.0,SARS-CoV-2,True
12,"We conducted observational studies using serum of hospitalized COVID-19 patients and determined that such autoantibodies are indeed induced, independently of anti-RBD levels. Instead, their presence and levels were strongly correlated with blood pressure dysregulation and poor oxygenation. We finally demonstrated cross-reactivity of some antibodies between AngII and the Spike protein, suggesting immune epitope homology between these molecules.",1.0,COVID-19,True
13,2,0.0,,False
14,"medRxiv preprint doi: https://doi.org/10.1101/2021.11.02.21265789; this version posted November 2, 2021. The copyright holder for this preprint (which was not certified by peer review) is the author/funder, who has granted medRxiv a license to display the preprint in perpetuity. It is made available under a CC-BY-NC-ND 4.0 International license .",0.0,,False
15,RESULTS AND INTERPRETATION We began by assessing the presence of IgG antibodies against AngII in the,0.0,,False
16,"plasma of 221 subjects, among which 115 were hospitalized COVID-19 patients convalescent from a SARS-CoV-2 infection, 58 were control donors (i.e. non-SARSCoV-2 infected and non-hypertensive), and 48 were hypertensive non-SARS-CoV-2 infected donors. Surprisingly, we found that a substantial proportion, 63% (73/115), of the COVID-19 patients had positive levels of anti-AngII autoantibodies, as determined by an ELISA absorbance greater than 3 standard deviations above the mean of the control donor group (Fig. 1A). Of these, 53% (39/73) had high levels, defined as greater than twice the positive threshold. In contrast, only one control donor (1.7%) was antiAngII positive, with a level just above the positive limit. Patient age, sex, and body mass index (BMI) were not significantly correlated with anti-AngII positivity (Fig S1A-D), although older patients trended towards increased levels of anti-AngII (p,""0.064 by Spearman correlation, Fig. S1A). Additional trends suggested that female COVID-19 patients were more likely to develop high anti-AngII levels (42% vs. 25% of males, Fig. S1B) as well as patients with BMI  25 (38% vs. 20% of patients with normal BMI, Fig. S1C, D).""",1.0,COVID-19,True
17,"Since a majority of the hospitalized COVID-19 patients in this cohort had preexisting hypertension (COVID HTN, 64%), we measured anti-AngII levels in plasma from hypertensive donors taken prior to the pandemic (non-COVID HTN) to determine whether autoantibodies against AngII could have been pre-existing in HTN patients. Interestingly, we detected anti-AngII antibodies in 15% of these hypertensive donors (Fig. 1A, B), which was far less than in COVID-19 patients. Furthermore, when comparing the HTN vs. non-HTN COVID-19 patients, the levels of anti-AngII were similar (Fig. 1C) as well as the percentages with positive levels (65% and 60%, respectively; Fig. 1D). These results indicate that infection with SARS-CoV-2 promotes the development of anti-AngII IgG antibodies in a majority of patients that developed severe",1.0,COVID-19,True
18,3,0.0,,False
19,"medRxiv preprint doi: https://doi.org/10.1101/2021.11.02.21265789; this version posted November 2, 2021. The copyright holder for this preprint (which was not certified by peer review) is the author/funder, who has granted medRxiv a license to display the preprint in perpetuity. It is made available under a CC-BY-NC-ND 4.0 International license .",0.0,,False
20,"disease (i.e., required hospitalization), regardless of whether they had pre-existing hypertension.",1.0,disease,True
21,"Next, we asked whether the presence and levels of anti-AngII antibodies correlated with those of antibodies directed against the receptor-binding domain (RBD) of the virus' Spike protein. As expected, most patients (76%) developed positive levels of anti-RBD antibodies, here considered above a total IgG titer of 3 based on healthy control levels (Fig. S2A). However, correlations between anti-RBD levels and anti-AngII levels were only modest; in fact, a majority of anti-AngII(-) patients developed antibodies against RBD (Fig. 1E), and patients with high anti-RBD titers did not necessarily develop anti-AngII antibodies (34% remained anti-AngII(-)) (Fig. 1F). In addition, although patients positive for one antibody were more likely to be positive for the other, this effect was not statistically significant (p,0.056 and p,""0.087 using 2 tests comparing the proportion of anti-AngII(+) patients across the anti-RBD (-/Lo/Hi) groups, and viceversa). Similar results were observed when considering the average antibody levels instead of proportions of positive patients. Despite a slight increase in anti-AngII levels along with anti-RBD levels (Fig.S2B, S2C), no significant correlation was observed between them when analyzing the plasma of patients collected after 7 days postsymptom onset (DPSO), which is the approximate time needed to observe a new IgG response in blood upon primary infection (Fig. 1G, p"",0.29 by Spearman test).",1.0,positive,True
22,4,0.0,,False
23,"medRxiv preprint doi: https://doi.org/10.1101/2021.11.02.21265789; this version posted November 2, 2021. The copyright holder for this preprint (which was not certified by peer review) is the author/funder, who has granted medRxiv a license to display the preprint in perpetuity. It is made available under a CC-BY-NC-ND 4.0 International license .",0.0,,False
24,"Figure 1. SARS-CoV-2 infection induces anti-AngII autoantibodies. The plasma of SARSCoV-2 convalescent hospitalized patients (COVID, N,""115) was analyzed for the presence of antiAngII and anti-RBD by ELISA. Among them, 63% had with pre-existing hypertension (HTN COVID, N"",""73). Results were compared to non-COVID hypertensive donors (Non-COVID HTN, N"",48) or control donors (N,58). Anti-AngII levels are displayed as the signal absorbance measured in plasma diluted at 1:100. Anti-RBD titers are displayed as log10 values. (Hi , high; Lo , low; (-) , negative; gray thresholds , limits for anti-AngII or anti-RBD positivity) (A) Levels of anti-AngII antibodies in the plasma of COVID patients as compared to non-COVID HTN donors",1.0,SARS-CoV-2,True
25,5,0.0,,False
26,"medRxiv preprint doi: https://doi.org/10.1101/2021.11.02.21265789; this version posted November 2, 2021. The copyright holder for this preprint (which was not certified by peer review) is the author/funder, who has granted medRxiv a license to display the preprint in perpetuity. It is made available under a CC-BY-NC-ND 4.0 International license .",0.0,,False
27,"and control donors (median ± IQR, Kruskal-Wallis test with Dunn's post-test). An absorbance  0.077 and  0.154 indicates the limit for anti-AngII positivity and high levels, respectively. (B) Proportion of non-COVID HTN and COVID donors that have high (Hi), low (Lo) or negative (-) levels of anti-AngII (2 test). (C) Levels of anti-AngII in COVID patients with or without pre-existing HTN (Mann-Whitney test). (D) Proportion of non-HTN COVID and HTN COVID patients that have high (Hi), low (Lo) or negative (-) levels of anti-AngII (2 test). (E) Proportion of patients with high, low or no titers of anti-RBD among patients having high, low or negative levels of anti-AngII (2 test). (F) Proportion of patients with high, low or negative levels of anti-AngII among patients having high, low or no titers of anti-RBD (2 test). (G) Correlation between antiAngII levels and anti-RBD titers in COVID patients. Patients for which the plasma was analyzed at or after 7 days post-symptoms (DPSO) are indicated in black, whereas those analyzed before 7 DPSO are in grey (Spearman correlation on datapoints  7 DPSO). (H) Co-variations of antiAngII and anti-RBD levels between 1-10 DPSO (tail of the arrow) and 11-20 DPSO (tip of the arrow) matched per patient (arrow, N,25).",1.0,negative,True
28,"We then questioned when anti-AngII antibodies developed relative to anti-RBD antibodies after SARS-CoV-2 infection by comparing their levels between early vs. later times (1-10 vs. 11-20 DPSO) in the 25 anti-AngII(+) patients for which these timepoints were available. From early to late, some patients showed increases in both anti-RBD and anti-AngII (Fig. 1H in red, 15/25), while others showed increases in anti-RBD accompanied by decreases in anti-AngII (Fig. 1H in blue, 10/25). Between these times, the increase in anti-RBD levels reached statistical significance (Fig. S2D), as expected, whereas the increase in anti-AngII levels did not (Fig. S2E, p,""0.18 by Wilcoxon matched pairs sign rank test). Moreover, anti-AngII antibodies were still detected in 11 patients at >45 DPSO (Fig. S2F), suggesting that either anti-AngII antibodies are long-lasting, or that they are maintained over a long-lasting symptomatic period in these patients. Together, these data suggest that antibodies levels generated against AngII are not necessarily correlated with those against RBD.""",1.0,SARS-CoV-2,True
29,"We next studied the development of anti-AngII IgG in mice upon exposure to SARS-CoV-2 antigens (note that murine and human AngII are 100% homologous). We vaccinated mice at 0 and 21 days with 10 g Spike or RBD, admixed with either (i) the",1.0,SARS-CoV-2,True
30,6,0.0,,False
31,"medRxiv preprint doi: https://doi.org/10.1101/2021.11.02.21265789; this version posted November 2, 2021. The copyright holder for this preprint (which was not certified by peer review) is the author/funder, who has granted medRxiv a license to display the preprint in perpetuity. It is made available under a CC-BY-NC-ND 4.0 International license .",0.0,,False
32,"Toll-like receptor (TLR) 4 agonist monophosphoryl lipid A in alum (MPLA/Alum, mimicking the AS04 clinical adjuvant), (ii) AddaS03 (a formulation of composed of tocopherol, squalene and polysorbate 80 in an oil-in-water nano-emulsion, mimicking the AS03 clinical adjuvant), (iii) the TLR9 agonist CpG-B, or (iv) no adjuvant. None of the naïve mice (0/25) had detectable anti-AngII IgG (Fig. 2A). In contrast, 24% (6/25) of the mice vaccinated with RBD + MPLA/Alum and 27% (4/15) of mice vaccinated with Spike + MPLA/Alum developed antibodies against AngII. Interestingly, none of the mice vaccinated with Spike + AddaS03 (0/9) or with RBD + CpG (0/10) developed anti-AngII antibodies, as well as none of the mice vaccinated with unadjuvanted RBD or Spike (0/10 each), or with MPLA/Alum lacking antigen (0/20).",1.0,clinical,True
33,"We further analyzed the time course of the immune responses in mice, measuring anti-AngII levels at weeks 1, 2, 3 and 4 for the mice vaccinated with RBD + MPLA/alum or Spike + MPLA/Alum that were positive for anti-AngII. This analysis highlighted an increase in anti-AngII levels over time, specifically between weeks 1-2 and week 4 post-vaccination (Fig. 2B). Of note, the increase in anti-AngII IgG titers was more substantial after the vaccination boost at week 3. These results demonstrate that anti-AngII autoantibodies can be induced in mice by vaccination against Spike or RBD, in the absence of SARS-CoV-2 infection, at least with MPLA/Alum-containing adjuvants.",1.0,positive,True
34,7,0.0,,False
35,"medRxiv preprint doi: https://doi.org/10.1101/2021.11.02.21265789; this version posted November 2, 2021. The copyright holder for this preprint (which was not certified by peer review) is the author/funder, who has granted medRxiv a license to display the preprint in perpetuity. It is made available under a CC-BY-NC-ND 4.0 International license .",0.0,,False
36,"Figure. 2. Development of anti-AngII autoantibodies in a subset of mice vaccinated with adjuvanted SARS-CoV-2 antigens. Mice were vaccinated at week 0 and 3 with Spike or RBD proteins adjuvanted with MPLA/alum, CpG-B, AddaS03 or with no adjuvant, or with MPLA/alum only (in absence of SARS-CoV-2 antigen). N,10-25 mice per group. (A) Anti-AngII levels in vaccinated mice plasma at week 4. Significant proportions of mice vaccinated with RBD + MPLA/alum or Spike + MPLA/alum raised autoantibodies against AngII (Z-test for proportions: RBD+MPLA/alum vs MPLA/alum: Z,""2.35, Spike+MPLA/alum vs. MPLA/alum: Z"",""2.45, grey threshold "","" limit for anti-AngII positivity). (B) Levels of anti-AngII autoantibodies over time (at week 1, 2, 3 and 4) in the mice that were found positive for anti-AngII at week 4 (Friedman test with Dunn's post-test).""",1.0,SARS-CoV-2,True
37,"Having determined that anti-AngII antibodies could develop both in hospitalized COVID-19 patients and in mice after vaccination with MPLA/alum-adjuvanted SARSCoV-2 antigens, we further examined hospitalized COVID-19 patients for potential correlative effects of anti-AngII antibodies on blood pressure dysregulation, blood oxygenation, and disease severity. First, we observed that the levels of anti-AngII were significantly higher in patients with dysregulated blood pressure (BP), as defined by (i) episodes of hypotension that required administration of vasopressors, (ii) large daily fluctuations in blood pressure (daily mean arterial pressure range (MAP)  70 mmHg), or (iii) at least 2 consecutive days of hypotension (MAP < 65 mmHg) in patients with preexisting HTN (Fig. 3A). Moreover, this correlation remained significant when each of these subgroups were analyzed separately, despite the low number of patients available",1.0,COVID-19,True
38,8,0.0,,False
39,"medRxiv preprint doi: https://doi.org/10.1101/2021.11.02.21265789; this version posted November 2, 2021. The copyright holder for this preprint (which was not certified by peer review) is the author/funder, who has granted medRxiv a license to display the preprint in perpetuity. It is made available under a CC-BY-NC-ND 4.0 International license .",0.0,,False
40,"(Fig. 3B). Of note, these 3 subgroups of patients with dysregulated PB are not exclusive, with 52% of patients belonging to multiple categories. Consistent with these observations, a majority of patients with blood pressure dysregulation were positive for anti-AngII (81% vs. 53% in patients with normal blood pressure, Fig. 3C), among which 45% had high levels of anti-AngII. And finally, patients needing vasopressors were the most likely to have positive or high levels of anti-AngII, although among each of the groups with dysregulated blood pressure, >80% were anti-AngII(+) (Fig. 3D).",1.0,positive,True
41,"Since AngII is a critical regulator of blood pressure, we further hypothesized that COVID-19 patients with pre-existing HTN might be more sensitive to the effects of antiAngII antibodies, if they were sufficiently abundant to alter the angiotensin signaling cascade. Therefore, we separated the patients with normal or dysregulated BP into subsets of patients with or without pre-existing HTN. Nevertheless, we found no striking difference between the non-HTN vs. HTN subsets that could support enhanced effects of anti-AngII in COVID patients with pre-existing HTN (Fig. 3E).",1.0,COVID-19,True
42,"Next, we questioned whether the presence or levels of anti-AngII antibodies correlated with reduced blood oxygenation and disease severity, measured via the daily mean oximetric saturation (SF ratio), which is the ratio of peripheral oxygen saturation (SpO2) to the fraction of inspired oxygen (FiO2). For each patient, we selected the lowest daily mean SF ratio value obtained within a two-day window of the measurement of antiAngII. The lowest daily mean SF ratio was compared between the COVID-19 patients who developed auto-antibodies against AngII (73 patients) and those who did not (42 patients). We found that the SF ratio was strongly reduced in anti-AngII(+) patients (Fig. 3F), demonstrating a correlation between anti-AngII antibodies and reduced blood oxygenation in these patients.",1.0,disease,True
43,9,0.0,,False
44,"medRxiv preprint doi: https://doi.org/10.1101/2021.11.02.21265789; this version posted November 2, 2021. The copyright holder for this preprint (which was not certified by peer review) is the author/funder, who has granted medRxiv a license to display the preprint in perpetuity. It is made available under a CC-BY-NC-ND 4.0 International license .",0.0,,False
45,"Figure 3. Anti-AngII autoantibodies correlates with dysregulated blood pressure (BP) and reduced pulse oxymetric saturation SpO2/FiO2 (SF ratio) in hospitalized COVID patients (N,115). Grey threshold indicates positivity of anti-AngII. (A) Anti-AngII levels in the plasma of COVID patients with normal or dysregulated blood pressure (Mann-Whitney test). (B) Levels of anti-AngII antibodies in COVID patients with normal BP as compared to patients with",0.0,,False
46,10,0.0,,False
47,"medRxiv preprint doi: https://doi.org/10.1101/2021.11.02.21265789; this version posted November 2, 2021. The copyright holder for this preprint (which was not certified by peer review) is the author/funder, who has granted medRxiv a license to display the preprint in perpetuity. It is made available under a CC-BY-NC-ND 4.0 International license .",0.0,,False
48,"dysregulated BP, categorized as being under vasopressive drugs, exhibiting a large mean arterial pressure variability (large MAP) or having experienced severe acute hypotensive episodes despite their known pre-existing HTN condition (these categories are non-exclusive; KruskalWallis test with Dunn's post-test comparison to normal BP). (C) Proportion of patients with normal or dyregulated BP that have negative (-), low (Lo) or high (Hi) levels of anti-AngII antibodies (2 test). (D) Proportions of patients with negative, low or high levels of anti-AngII in the COVID patients categories described in panel B. (E) Proportions of patients with negative, low or high levels of anti-AngII in COVID patients with pre-existing HTN and/or dysregulated BP. (F) SF ratio of COVID patients that are negative (-) or positive (+) for anti-AngII autoantibodies (Mann-Whitney test). SF ratio values are used to define disease severity as being mild, moderate or severe. (G) Levels of anti-AngII antibodies in patients suffering from mild, moderate or severe form of COVID, as defined based on SF ratio values (Kruskal-Wallis test with Dunn's post-test). (H) Proportion of patients with negative (-), low (Lo) or high (Hi) levels of anti-AngII antibodies in function to the severity of the disease (2 test).",1.0,negative,True
49,"Since the clinical severity of COVID directly depends on the patient's blood oxygenation, patients with SF ratio  314 are considered as having a disease of low severity, while patients with SF ratio < 235 suffer from a highly severe form of COVID. Based on this, we then compared anti-AngII levels with disease severity and found that patients with severe vs. mild disease had increased anti-AngII antibodies (p,""0.053, Fig. 3G). Similarly, we found a significant increase in the proportion of anti-AngII(+) patients along with disease severity (p"",""0.035 by 2 test, Fig. 3H). Indeed, 77% of patients with severe disease were anti-AngII(+), including 41% with high levels, as compared to 50% and 29%, respectively, in patients with mild disease.""",1.0,clinical,True
50,"Together, these results demonstrate a correlation between the presence and levels of anti-AngII in COVID-19 patients and dysregulated blood pressure, lower blood oxygenation, and increased disease severity. While causal relationships cannot be drawn from these correlations, the fact that AngII is a key regulator of blood pressure in humans suggests that antibodies directed against anti-AngII could alter AngII signaling pathways, including its binding to and signaling via the angiotensin receptors AT1 and AT2. as well as on its enzymatic conversion by ACE2. Further experiments are needed",1.0,COVID-19,True
51,11,0.0,,False
52,"medRxiv preprint doi: https://doi.org/10.1101/2021.11.02.21265789; this version posted November 2, 2021. The copyright holder for this preprint (which was not certified by peer review) is the author/funder, who has granted medRxiv a license to display the preprint in perpetuity. It is made available under a CC-BY-NC-ND 4.0 International license .",0.0,,False
53,to establish the pathophysiological consequences of anti-AngII auto-antibodies in COVID-19 patients.,1.0,COVID-19,True
